kronologi,pasal
"Bahwa awalnya sekitar awal bulan Desember 2018 saat RIAN SUBROTO sedang berada di Cafe Delight alamat Gading Sari Lumajang bertemu dengan DHANI (DPO) lalu DHANI menawari saksi RIAN SUBROTO artis wanita atau selebgram untuk diajak kencan dalam artian berhubungan badan/ seks, dan RIAN SUBROTYO menyetujuinya; - Bahwa selanjutnya DHANI menghubungi saksi TENTRI NOVANTA melalui telepon dan via sms di Whatsapp yang intinya meminta untuk disediakan jasa artis untuk berhubungan seks dengan seseorang di Surabaya, kemudian TENTRI NOVANTA menawarkan kepada DHANI nama sejumlah artis termasuk saksi VANESZA ADZANIA als VANESA ANGELIA ADZAN als VANESSA ANGEL (terdakwa dalam berkas perkara terpisah) kepada DHANI, setelah itu DHANI menyampaikan hal tersebut kepada saksi RIAN SUBROTO dan saksi RIAN SUBROTO kemudian tertarik untuk menggunakan jasa layanan seksual artis saksi VANESZA ADZANIA als VANESA ANGELIA ADZAN als VANESSA ANGEL dan orang yang bernama MARIA DELIMA SIAHAAN als AVRIELLYA SHAQILLA tersebut dan kemudian disampaikan kepada saksi TENTRI NOVANTA",pasal 27 ayat 1
"Bahwa pada hari Senin tanggal 06 Mei 2019 sekira pukul 13.45 Wib Saksi Irfan Afandi Siregar (anggota polisi Ditreskrimum Polda Sumut) melakukan komunikasi WhatsApp ke nomor 087846819272 milk terdakwa dengan mengatakan bahwa saksi Irfan Afandi Siregar mendapat nomor terdakwa dari Pina , kemudian saksi Irfan Afandi Siregar menanyakan “apakah terima booking cewek?” lalu dijawab terdakwa “ya saya bisa” dan pada saat itu saksi Irfan Afandi Siregar dengan terdakwa membicarakan tentang cewek / perempuan yang bisa digunakan jasa seksnya, dan pada saat itu saksi Irfan Afandi Siregar Bahwa pada hari Senin tanggal 06 Mei 2019 sekira pukul 13.45 Wib Saksi Irfan Afandi Siregar (anggota polisi Ditreskrimum Polda Sumut) melakukan komunikasi WhatsApp ke nomor 087846819272 milk terdakwa dengan mengatakan bahwa saksi Irfan Afandi Siregar mendapat nomor terdakwa dari Pina , kemudian saksi Irfan Afandi Siregar menanyakan “apakah terima booking cewek?” lalu dijawab terdakwa “ya saya bisa” dan pada saat itu saksi Irfan Afandi Siregar dengan terdakwa membicarakan tentang cewek / perempuan yang bisa digunakan jasa seksnya, dan pada saat itu saksi Irfan Afandi Siregar perbuatan cabul oleh orang lain dengan orang lain, dan menjadikannya sebagai pencarian atau kebiasaan, saksi korban Rika Wulandari Alias Rika dan saksi korban Arfany Pratiwi Als Fany merasa malu.",pasal 27 ayat 1
"Bahwa pada hari Kamis tanggal 16 Mei 2019 sekira pukul 14.00 Wib Akun WhatsApp (WA) nomor 085262689310 atas nama daengdani756 milik terdakwa menerima pesan dari Akun WhatsApp Nomor 082283743966 yang isinya mencari cewek yang menemani menikmati hiburan karoke ataupun mencari wanita yang mau melakukan hubungan seks, selanjutnya terdakwa menghubungi beberapa wanita kenalan terdakwa yang biasa melakukan layanan tersebut dan selanjutnya terdakwa meminta foto ke 3 (tiga) wanita tersebut untuk terdakwa kirimkan ke Akun WhatsApp Nomor 082283743966 dan setelah terdakwa kirimkan ke Akun WhatsApp Nomor 082283743966, Akun WhatsApp Nomor 082283743966 menolak ketiga wanita tersebut. Kemudian sekira pukul 18.00 Wib ketika terdakwa menyalon saksi korban Ria Renggalita Alias Via dan saksi korban Rini Utami Als Rini Als Sasa, pemilik Akun WhatsApp Nomor 082283743966 kembali menghubungi terdakwa melalui panggilan WhatsApp untuk menanyakan pesanannya, kemudian terdakwa menawarkan job tersebut kepada saksi korban Ria Renggalita Alias Via dan saksi korban Rini Utami Als Rini Als Sasa dan saksi korban Ria Renggalita Alias Via dan saksi korban Rini Utami Als Rini Als Sasa setuju, lalu terdakwa mengirimkan foto saksi korban Ria Renggalita Alias Via dan saksi korban Rini Utami Als Rini Als Sasa ke pemilik Akun WhatsApp Nomor 082283743966 dan pemilik Akun WhatsApp Nomor 082283743966 langsung setuju dengan foto yang terdakwa kirimkan. Kemudian antara terdakwa dengan pemilik Akun WhatsApp Nomor 082283743966 melakukan tawar menawar harga / tarif, lalu terdakwa dan pemilik Akun WhatsApp Nomor 082283743966 sepakat bahwa tariff untuk layanan sekali bersetubuh / Short Time sebesar Rp. 1.500.000,(satu juta lima ratus ribu rupiah) / orang dan fee atas jasa terdakwa sebesar Rp. 300.000,(tiga ratus ribu rupiah). Kemudian sekira pukul 22.00 Wib terdakwa bersama dengan saksi korban Ria Renggalita Alias Via dan saksi korban Rini Utami Als Rini Als Sasa pergi ke Hotel Grand Aston City Hall di Jalan Balai Kota Medan dan setibanya di Hotel Grand Aston City Hall di Jalan Balai Kota Medan lalu terdakwa bersama dengan saksi korban Ria Renggalita Alias Via dan saksi korban Rini Utami Als Rini Als Sasa diarahkan ke Kamar nomor 709 dan pada saat didalam kamar terjadi proses pembayaran dan tidak berapa lama kemudian setelah selesai proses pembayaran lalu datang saksi Ricky R. Sembiring,SH dan saksi Nurifddini Kholida,SE (keduanya anggota Ditreskrimsus Polda Sumut) langsung melakukan penangkapan terhadap terdakwa bersama dengan saksi korban Ria Renggalita Alias Via dan saksi korban Rini Utami Als Rini Als Sasa dan pada saat penangkapan telah ditemukan dan disita barang bukti berupa 1 (satu) unit handphone Merk OPPO F1S warna Rose Gold, yang didalamnya terpasang SimCard Nomor 085262689310 dan SimCard untuk Paket Internet (Nomor tidak diketahui) serta didalamnya terinstal Akun WhatsApp Nomor 085262689310 dan Uang tunai sebesar Rp. 3.300.000 (tiga juta tiga ratus ribu rupiah) terdiri dari tukaran uang Rp.100.000 (seratus ribu rupiah) sebanyak 33 (tiga puluh tiga) lembar,selanjutnya terdakwa berikut barang bukti dibawa ke Kantor Ditreskrimsus Polda Sumut guna proses hukum lebih lanjut.",pasal 27 ayat 1
"Bermula pada  hari Jumat 6 September 2019 saksi korban Ida Royanti melalui akun fb korban Ida Ida meminta pertemanan dengan akun fb kepada TERDAKWA Kemudian pada malam harinya komunikasi antara TERDAKWA dan saksi (korban) Ida Royanti berlanjut melalui chatt fb messanger dan bertukar nomor tlp dan WA, saksi (korban) an. Ida Royanti memberikan nomor telpon dan WA nya 0821-83123470, dan tersangka memberikan nomor hp atau WA yang saat itu tersangka gunakan yaitu 0895-620049274. Kemudian pada Hari Sabtu tanggal 7 September 2019 Malam sekira pukul 22.00 Wib saksi (korban) dan TERDAKWA menggunakan seragam Polisi melakukan video call via WA 0895-620049274, Lalu karena saksi (korban) sudah percaya dengan TERDAKWA, saksi (korban) pun menceritakan kehidupan pribadi/curhat (pekerjaan, kehidupan rumah tangga yang kurang sedang kurang harmonis). Selanjutnya Setelah sekian lama bervideo call curhat, TERDAKWA minta bukti tanda cinta dari saksi (korban) kepada TERDAKWA. Kemudian TERDAKWA mengatakan ‘Malem ini kita melakukan seperti yang suami istri lakukan. Selanjutnya saksi (korban) Ida Royanti menggunakan WA 0821-83123470 dan TERDAKWA menggunakan WA 0895-620049274, melakukan video call, saat itu saksi (korban) Ida Royanti diminta TERDAKWA melepas bajunya (telanjang) dan TERDAKWA pun sempat menurunkan celananya serta melakukan onani. Dan pada saat itu juga ternyata TERDAKWA mensreenshoot foto saksi (korban) Ida Royanti. lalu Saat itu TERDAKWA berjanji akan mengunjungi saksi (korban) Ida Royanti ke Palembang, di hari Senin tanggal 9 September 2019.  Kemudian pada hari Senin, 9 September 2019 jam 10.30 Wib dengan alasan mobil macet karena habis bensin (dalam perjalanan menuju Palembang), TERDAKWA meminta saksi (korban) Ida Royanti mentransfer uang sebesar Rp. 400.000,- (empat ratus ribu rupiah) ke rekening Mandiri an. Selvi Puspita Sari melalui rekening 113-0013592047 yang diakui TERDAKWA milik mantan istri pelaku, yang kemudian ditransefer secara manual oleh saksi (korban) Ida Royanti ke Bank Mandiri di Jalan Sosial Palembang. Kemudian Sekira jam 18.30 Wib, TERDAKWA nelpon melalui WA, dan TERDAKWA minta dikirim oleh saksi (korban) Ida Royanti uang sebesar Rp.300.000,- lagi dengan alasan buat beli oleh-oleh. Namun tidak dikabulkan oleh saksi (korban) Ida Royanti. Kemudian pada Rabu tanggal 11 September 2019 Jam 06.30 Wib TERDAKWA menghubungi saksi (korban) Ida Royanti via WA menanyakan perihal peermintaan pengiriman uang sebesar Rp. 300.000,- (tiga ratus ribu rupiah), dan mengirimkan kembali nomor rekening Mandiri an. Selvi Puspita Sari dengan no rek 113-00-1359204-7, namun korban tetap tidak mengabulkan. Kemudian pada hari Rabu tanggal 11 September 2019 sekira pukul 03.00 Wib, saksi an. Indah Sari Binti Ibrahim (melalui akun fb saksi yaitu Indah Bundany Fanihany mendapatkan pesan permintaan pertemanan dari fb messanger akun Ida Ida dengan foto profil gambar Sdri. Ida Royanti tanpa busana dan mengirimkan gambar asusila tersebut adalah TERDAKWA dan pada hari itu juga TERDAKWA sudah meyebarkan foto-foto asusila saksi (korban) yang tidak pantas di media sosial dan sudah menjadi pembicaraan di pasar Palimo Palembang.Dan pada hari itu juga TERDAKWA chatt dengan saksi Neny Binti Abu Hasan melalui WA yang merupakan ibu kandung saksi (korban) Ida Royanti. Kemudian TERDAKWA meminta Saksi (korban) Ida Royanti untuk menghubungi TERDAKWA di nomor 0813-67330053, apabila tidak segera minta maaf, maka TERDAKWA mengancam akan menyebarkan foto-foto tidak pantas saksi (korban) yang lain.",pasal 27 ayat 1
"Bahwa Terdakwa AHMAD FAISAL NASUTION Als FAISAL FORSU NASUTION selaku Ketua LSM FORSU yang sedang menyoroti kinerja pejabat di PDAM Tirtanadi terkait dugaan korupsi serta beberapa permasalahan lain diantaranya perihal air PDAM yang tidak mengalir/mati selama 3 (tiga) hari, kenaikan tariff air minum dan kisruh penerimaan pegawai yang tak kunjung selesai selanjutnya pada hari Kamis tanggal 16 November 2017 sekira jam 15.34 Terdakwa melihat postingan status pada halaman Facebook Adesandrawati Purba dengan tulisan “cerita sedih menjelang malam,..ketika sang Pemimpin dan Pengawas nerimo upeti untuk sebuah jabatan kadiv,..sang Kadiv Cinderelapun tak takut diberi peringatan oleh pimpinan walaupun sudah kedapatan sedang mesum dalam ruangan kerja oleh office boy,..dan malah menantang sang Pimpinan kalau coba berani memindahkannya akan membongkar semua transaksi rahasianya #efekruangkerjadikuncisistem #bebasmelakukantindakan amoral #wanita dan moral dan postingan dihalaman facebook Anwar Sanusi yang bertuliskan “ada apa – apa ada Status facebook bu#Adesandrawatipurba Dirut PDAM tidak berani menindak Kadiv Cinderlla yang mesum. Bahwa pada sekira jam 16.30 WIB Terdakwa datang ke Kantor PDAM Tirtanadi di Jalan Sisingamangaraja No.1 Medan dengan tujuan untuk menemui bagian Humas namun oleh Satpam tidak diperkenankan masuk dengan alasan hari telah sore selanjutnya Terdakwa pergi menuju kafe Republik Coffe di Jalan Pemuda Kecamatan Medan Maimun Kota Medan lalu dengan menggunakan iphone 5 Terdakwa membuka akun facebook FAISAL FORSU NASUTION milik Terdakwa dan membuat tulisan pada halaman facebook tersebut “Kadiv Umum PDAM TIRTANADI FM kasi tubuh mesum diruangan & beri SPK sama rekanan ganteng mungkin juga gede punya barang benarkah ? selanjutnya Terdakwa dengan menggunakan laptop mengakses internet mencari foto dari saksi Dr. Hj.FEBY MILANIE, S.T., M.M. selaku Kepala Divisi Umum PDAM Tirtanadi lalu mengedit foto tersebut menggunakan aplikasi Pic.Collage dan menampilkan foto saksi berdampingan dengan foto tokoh politik Setya Novanto dengan menambahkan tulisan “ada yang kenal dan tau gak sama ibu dan bapak ini,..saya pengen klarifikasi cerita tentang mereka,..saya Cuma mau bertanya,..?? ada yang kenal gak ya..??? dan tulisan tersebut dapat diakses oleh orang lain karena setelah beberapa saat memajang status tersebut beberapa orang menuliskan komentar yang ditulis oleh Terdakwa. ",pasal 27 ayat 1
"Bahwa ia terdakwa DIDIK ISKANDAR Bin SUDAR pada hari Kamis tanggal 04 Juli 2019 sekira pukul 21.00 Wib atau setidak-tidaknya pada suatu waktu dalam bulan Juli 2019 bertempat di rumah terdakwa di Desa Panca Mukti Jalur 6 Kec. Muara Telang Kab. Banyuasin atau setidak-tidaknya pada suatu tempat yang masih termasuk dalam daerah Hukum Pengadilan Negeri Banyuasin, dikarenakan sebagian besar saksi yang dipanggil lebih dekat pada tempat Pengadilan Negeri Palembang (berdasarkan Pasal 84 ayat (2) KUHAP) juga berwenang untuk memeriksa dan mengadili perkaranya, dengan sengaja dan tanpa hak mendistribusikan dan/ atau mentransmisikan dan/atau membuat dapat diaksesnya Infomarsi Elektronik dan/atau dokumen elektronik yang memiliki muatan yang melanggar kesusilaan, perbuatan tersebut dilakukan oleh terdakwa dengan cara atau setidak-tidaknya dengan cara sebagai berikut : Bermula pada hari, tanggal dan waktu tersebut di atas, terdakwa yang sedang berada di rumahnya di Jalur 6 Desa Panca Mukti Kec. Muara Telang Kab. Banyuasin, datang sdr. WANDI (identitas tidak jelas) ke rumah terdakwa dan terdakwa berbincang-bincang dengan sdr. WANDI, setelah itu terdakwa bertanya kepada sdr. WANDI ""apakah bisa membuat akun Facebook"", dan sdr. WANDI menjawab ""bisa"". Kemudian terdakwa menyerahkan handphonenya kepada sdr. WANDI, yang mana di HP terdakwa sudah ada applikasi Facebook. Sdr. WANDI membuat akun Facebook dengan nomor telepon milik terdakwa yaitu 081367497272 yang sudah berada di dalam HP terdakwa. Terdakwa menyuruh sdr. WANDI membuat akun Facebook tersebut dengan nama akun ""Rena"", setelah jadi akun Facebook dengan nama akun ""Rena"". Terdakwa memainkan akun Facebook tersebut, yang mana sebelumnya terdakwa sudah berniat akan memunggah (posting) foto asusila saksi WARNI dengan tujuan untuk mempermalukan saksi WARNI karena saksi WARNI mempunyai hutang kepada terdakwa sebesar Rp.5.000.000,- (lima juta rupiah) yang tidak dibayar-bayar oleh saksi WARNI. Terdakwa menggugah foto saksi WARNI dalam keadaan tidak berpakaian dengan menambahkan tulisan ""Lonte ini nmo fb nyo niken gemini aslinyo nmonyo warni siapo nk mkk dio ljulah tpi barangnyo busuk "". Terdakwa yang sudah kenal dengan saksi WARNI di Panti Pijat Permata, sudah 2 (dua) kali mengajak saksi WARNI untuk menginap di Hotel Tiga Putra, yangÂ mana dari situlah terdakwa mendapatkan foto-foto asusila saksi WARNI dengan cara terdakwa memfoto saksi WARNI pada saat saksi WARNI tertidur dan tidak menggunakan pakaian sekitar bulan Mei 2019 sekira pukul 00.30 Wib . Bahwa sebelumnya saksi WARNI pada hari Kamis tanggal 04 Juli 2019 sekira pukul 20.00 Wib, saat saksi sedang berada di tempat kerjanya di Jalan Kolonel H. Burlian No.399 Rt.011 Kel. Karya Baru Kec. Sukarami Palembang menerima ""chat"" Whatsapp dari terdakwa yang berisi kalimat bahwa akan ada pengiriman foto diri saksi di media sosial Facebook. Namun saksi tidak begitu menanggapi chat dari terdakwa tersebut. Dan sekira pukul 21.00 Wib saat saksi membuka akun Facebooknya dengan nama akun ""niken gemini"" tiba-tiba ada permintaan teman dari akun Facebook ""Rena"", namun saksi mengabaikannya. Setelah melihat-lihat unggahan-unggahan (postingan) di Facebook, saksi yang penasaran melihat profil akun Facebook ""Rena"" dan benar saksi melihat sudah ada unggahan foto-foto diri saksi oleh akun Facebook ""Rena"" tersebut. Lalu sekira pukul 23.17 Wib benar saksi melihat sudah ada unggahan foto-foto asusila dirinya yang diunggah oleh akun facebook ""Rena"".",pasal 27 ayat 1
"Bermula pada bulan Oktober 2018 sekira pukul 22.06 wib, pada saat saksi SUSILA HERMAWATI BINTI SUKIRMAN sedang berada dirumahnya yang beralamat di Jalan Sukarela Km. 7 No. 288 Rt. 060 Rw. 002 Kelurahan Sukarami Kota Palembang, tiba-tiba saksi SUSILA HERMAWATI BINTI SUKIRMAN menerima pesan singkat via whatsapp berupa foto alat kelamin laki-laki melalui nomor hp saksi SUSILA HERMAWATI yaitu 08127889242 dan saksi SUSILA HERMAWATI mengetahui bahwa yang mengirim gambar tersebut adalah TERDAKWA dengan nomor hp. 089512538787. Yang mana sebelumnya antara TERDAKWA dan saksi SUSILA HERMAWATI pernah menjalin hubungan pacaran. Kemudian setelah saksi SUSILAWATI menerima foto tersebut saksi SUSILA HERMAWATI menghubungi saksi ENGGAT BINI SOBAT dan saksi ENGGAT pun mengatakan bahwa TERDAKWA nomor hp. 089512538787 juga mengirimkan foto alat kelamin laki-laki kepada saksi ENGGAT; Bahwa TERDAKWA mendidtribusikan foto-foto dan video asusila kepada saksi SUSILA HERMAWATI antara lain : Sekira tanggal 23 Desember 2019 pukul 15.00 wib saksi SUSILA HERMAWATI menerima video bermuatan asusila melalui Whatsapp, yaitu video seorang laki-laki sedang memegang alat kelaminnya berdurasi 3 detik ke nomor saksi SUSILA HERMAWATI, dan saksi pun mengetahui bahwa yang mengirimkan video tersebut adalah TERDAKWA dikarenakan saksi pernah berkunjung ke tempat tersebut dan mengenali latar belakang video tersebut adalah kamar mandi bertegel biru yang merupakan kamar mandi TERDAKWA dirumah neneknya serta saksi mengenali alat kelamin di video tersebut adalah alat kelamin TERDAKWA; Kemudian sekira malam tahun baru 2019 saksi SUSILAWATI HERMAWATI menerima 4 (empat) foto melalui whatsapp ke nomor saksi 081373446060 dari TERDAKWA dengan nomor 08974153751 yaitu Screenshoot chat Whatsapp antara saksi SUSILAWATI dengan TERDAKWA, Foto TERDAKWA dengan perempuan yang tidak tampak wajahnya sedang tidur berdua berpelukan, 2 (dua) foto alat kelamin laki-laki milik TERDAKWA. Bahwa terhadap semua foto tersebut saksi SUSILAWATI mengetahuinya bahwa foto tersebut yang mengirim adalah TERDAKWA dikarenakan saksi mengetahui latar belakang lokasi tersebut adalah rumah TERDAKWA di jalan DI. Panjaitan Lrg. Murni No. 132 Rt.002 Rw.001 Kel. Bagus Kuning Plaju Kota Palembang; Kemudian awal bulan Januari tahun 2019, saksi menerima whatapps gambar alat kelamin laki-laki dari nomor 089512538787 yang diketahui nomor tersebut adalah nomor TERDAKWA; Kemudian sekira tanggal 15 Januari 2019 pukul 21.56 wib TERDAKWA juga menggunakan nomor hp 089512538787 mengirimkan foto bermuatan asusila melalui whatsapp yaitu foto alat kelamin laki-laki kepada saksi ENGGAT BINTI SOBAT dengan nomor hp saksi 081271654848",pasal 27 ayat 1
"Berawal ketika saksi korban TUTI HAERATI berada di rumahnya di Tidung 8 Stp 10 saksi mengetahui kalau ada akun Facebook menggunakan identitas saksi yang disampaikan oleh adik ipar saksi Pr. Rodita Hayati dengan nama TOti Herati dan foto-foto yng ada dalam akun tersebut benar foto-foto Vulgar saksi TUTI HAERATI yang serta akun tersebut juga mengupload kalimat yang mempermalukan saksi. Saksi mengetahui perbuatan dengan cara membuat akun dengan mengunakan identitas saksi lalu memposting foto vulgar saksi berawal saksi korban TUTI HAERATI berhubungan melalui telepon dengan seseorang yang mengaku bernama IRWAN ADE sekitar dua tahun, dimana IRWAN ADE mengaku sebagai dosen dari Jogjakarta yang kuliah di Belanda karena diselingkuhi oleh istrinya.Saksi korban TUTI HAERATI mulai merasa curiga karena terdakwa HARIANTO SIRAJUDDIN alias ANTO yang menyamar sebgai IRWAN ADE mulai bertingkah aneh dengan cara meminta saksi korban TUTI HAERATI untuk berfoto bersama dengan adik iparnya (terdakwa HARIANTO ) tidak lama seteleh ditelepon oleh ADE IRAWAN datang terdakwa HARIANTO dan menyampaikan bahwa terdakwa HARIANTO diminta ADE IRAWAN berfoto bersama lalu saksi TUTI HAERATI bertanya dari mana mengetahui nomor Hp ADE IRAWAN dan dijawab kalau ADE IRAWAN yang menghubungi terdakwa HARIANTO. Beberapa hari kemudian datang lagi terdakwa menemui saksi korban TUTI HAERAWATI dan menyuruh saksi TUTI untuk berfoto bersama apabila tidak berfito maka terdakwa HARINTO akan dipukul oleh Bodyguard IRWAN ADE. Beberapa hari kemudian IRWAN ADE menelpon dan menyuruh agar saksi TUTI HAERAWATI berfoto dengan adik iparnya yakni terdakwa dengan memegang alat vitalnya sampai keluar onani beberapa menit terdakwa langsung datang dan menyampaikan kalau dihubungi oleh IRWAN ADE namun saksi TUTI tidak mau menuruti permintaan IRWAN ADE dan menyuruh terdakwa HARIANTO untuk mtidak menuruti keinginan IRWAN ADE dan menyuruh terdakwa menganti nomor HPnya namun terdakwa menolak karena nomor tersebut terdaftar di Grapari setelah itu terdakwa pulang.Saksi korban TUTI mulai curiga lalu meminta temannya yang ada di GRAPARI Telkomsel Petarani untuk melacak nomor tersebut dari pelacakan diperoleh info bahwa no Hp tersebut bukan di Belanda namun ada di sekitar Pallangan Kab. Gowa, untuk memastikan kecurigaan saksi TUTI membeli nomor baru lalu menghubungi nomor ADE IRAWAN dan saat diangkat mendengar suara HARIANTO saksi TUTI langsung mengatakan Kamu ANTO dan ia bilang Iya kak lalu ditanya selama ini kamu yang jadi IRWAN ADE namun telponnya langsung ditutup, setelah ketahuan kalakuannya dan sakit hati lalu terdakwa meneror saksi TUTI sampai kirim surat danmembuat Akun Facebook atas nama saksi TUTI seakan-akan akun tersebut milik saksi TUTI dan membuat status tidak wajar sekaligus mengirim melalui Massengeer ke teman-teman SMA saksi TUTI termasuk saksi NIRWANA SYAM, S.Pd dan saksi Hj. ANGGRENI , S. Pd, M. MPD bahkan terdakwa mengirim Video-video Vulgar saksi TUTI. Bahwa benar dulu sektar tahun 2013 saksi TUTI pernah minta tolong dibuatkan Akun Faceebook oleh Terdakwa IRWAN ADE sebelum kejadian pacaran dan saksi TUTI gunakan akun tersebut hanya sekitar 1 tahun antara tahun 2013 sampai 2014 jadi akun yang pernah dibuatkan terdakwa HARIANTO untuk saksi TUTI digunakan kembali oleh terdakwa dengan memakai identitas saksi TUTI dan menganti nama akun dari TUTI menjadi TOti haerati tanpa sepengetahuan saksi TUTI lalu terdakwa memposting foto vulgar saksi TUTi dan kalimat-kalimat hinaan. Akibat perbuatan terdakwa saksi TUTI merasa sangat malu dengan teman-temannya dan juga keluargannya.Terdakwa HARIANTO SIRAJUDDIN alias ANTO dengan sengaja tanpa hak dan melawan hukum melakukan manipulasi , penciptaan, perubahan, penghilangan, pengrusakan, informasi elektronik dan/atau dokumen elektronik dengan tujuan agar informasi elektronik dan / atau dokumen elektronik tersebut dianggap seolah-olah data yang otentik sehingga membuatsaksi korban TUTI merasakan malu. ",pasal 27 ayat 1
