kronologi,pasal
"Bahwa Terdakwa ANDHIKA PERMANA BIN JOKO MARYANTO pada kurun waktu antara tahun 2017 sampai dengan bulan Agustus 2018 bertempat di Warnet CYBERNET Jl. Abdul Muis Jebres Surakarta atau setidak-tidaknya masih dalam daerah hukum Pengadilan Ngeri Surakarta atau berdasarkan pasal 84 ayat (2) KUHAP dimana terdakwa ditahan dan kediaman sebagian besar saksi yang dipanggil lebih dekat pada tempat pengadilan negeri itu, maka pengadilan negeri Semarang berwenang memeriksa dan mengadili telah dengan sengaja dan tanpa hak atau melawan hukum memproduksi, menjual, mengadakan untuk digunakan, mengimpor, mendistribusikan, menyediakan atau memiliki sandi lewat komputer, kode akses atau hal-hal yang sejenis dengan itu yang ditujukan agar sistem elektronik menjadi dapat diakses dengan tujuan memfasilitasi perbuatan yang memiliki muatan perjudian",pasal 27 ayat 2
"Pada awal tahun 2019 Terdakwa bertemu dengan Charlie di Vietnam kemudian Terdakwa membuat kesepakatan dengan Charlie untuk membuat website dan program untuk perjudian online dan Terdakwa akan menerima keuntungan sebesar 10% dari keuntungan yang diperoleh website tersebut. Selanjutnya Terdakwa membuat website yang bernama https://sonybet.me, https://sonybet.me berisi tentang penawaran kepada orang-orang untuk bermain judi diantaranya taruhan sport, slot, casino dan togel secara online serta terkoneksi satu sama lain. Bahwa website https://sonybet.me adalah merupakan sebuah situs permainan judi online dimana orang yang ingin bermain terlebih dahulu melakukan pendaftaran dengan memasukan data yang berupa nama, nomor rekening, jenis bank dan nomor telepon (whatsapp). Setelah itu klik tombol daftar dan melakukan deposit minimal Rp10.000, (sepuluh puluh ribu rupiah) dengan cara mentransfer uang ke rekening BCA atas nama DETI RAHMAWATI dengan nomor rekening 183-130-5199 atau ke rekening BRI atas nama AMBIR SINGH dengan nomor rekening 531101004477502 atau ke rekening BNI atas nama PANDU KURNIAWAN dengan nomor rekening 0776912899 atau ke rekening Mandiri atas nama DAVID WONG dengan nomor rekening 1560012458412. Setelah transfer dan mengisi form deposit yang disediakan kemudian pemain mendapatkan chip sesuai dengan jumlah yang telah ditransfer. Selanjutnya pemain dapat langsung bermain di permainan yang ditawarkan oleh penyelenggara perjudian diantaranya yaitu : TEXAS POKER, CEME KELILING, DOMINO, CEME, CAPSA SUSUN, SUPER 10 dan OMAHA. Bahwa pada akhir bulan Januari 2019 Terdakwa kembali ke Indonesia yaitu ke rumah Terdakwa di Jl. Mayang Nomor 15/3 C Kelurahan Sekip Kecamatan Medan Petisah Kota Medan Sumatera Utara dan mengembangkan website https://sonybet.me dengan cara mengupload ke server/hosting untuk dapat dionlinekan dengan menggunakan laptop merk ACER Aspire V3-471G-53214G75MAKK dengan S/N NXRZ3SN004226244C57600 warna hitam dan menambahkan aplikasi Photoshop dan Microsoft Front Page dengan kode PHP. Setelah website tersebut berhasil dan dapat berjalan dengan baik Terdakwa serahkan kepada Charlie dengan panel BackEnd. Selanjutnya setelah Terdakwa menyerahkan pengoperasian website tersebut kepada Charlie, Terdakwa tetap melakukan maintenance/perawatan website https://sonybet.me untuk menghindari terjadinya error atau trouble yang dapat terjadi dalam penggunaan website tersebut. Bahwa pada tanggal 16 September 2019 saksi ANUAR melakukan pendaftaran di website https://sonybet.me. Setelah berhasil mendaftar saksi ANUAR mentransfer uang sebesar Rp400.378, (empat ratus ribu tiga ratus tujuh puluh delapan rupiah) ke rekening BCA atas nama DETI RAHMAWATI dengan nomor rekening 183-130-5199. Selanjutnya saksi memilih permainan CEME kemudian pemain dapat memilih tempat duduk yang kosong bertuliskan sit pada gambar lingkaran kuning. Setelah saksi menentukan berapa uang chip yang akan dipertaruhkan maka saksi mendapat 2 (dua) buah kartu yang dibagi secara acak yang masih tertutup dan menebak angka yang keluar pada kartu-kartu tersebut. Setelah saksi sudah membuka kedua kartunya maka saksi dapat bertaruh berapa besar uang chip yang akan dipertaruhkan berdasarkan besaran jumlah 2 (dua) kartu tadi dengan pemain lainnya dan bandar. Bahwa setelah saksi melakukan taruhan ternyata saksi kalah sehingga jumlah chipnya berkurang. Bahwa Terdakwa selaku pembuat dari website https://sonybet.me dalam mengelola dan merawat website tersebut Terdakwa menerima uang dari Charlie melalui rekening BCA atas nama WU KHIM EN dengan nomor rekening 5810485924. Bahwa Terdakwa sebagai pembuat website https://sonybet.me dalam menyelenggarakan kegiatan judi online tersebut tidak mendapat atau memiliki ijin dari pemerintah maupun pejabat atau instansi yang berwenang.",pasal 27 ayat 2
"Bahwa pada sekira bulan Oktober 2018 bertempat di Apartemen Greenbay Condo M 1aa, Pluit, Jakarta Utara, terdakwa RIBOBBY alias BOBBY, membuka situs perjudian www.sbobet.com dengan menggunakan handphone miliknya selanjutnya melakukan pendaftaran akun untuk dapat mengikuti permainan dalam website tersebut. Terdakwa selanjutnya mendapatkan akun dengan user name aat13mv001 dengan pasword aa989898 dari admin, kemudian terdakwa melakukan deposit dengan cara mentransfer uang ke rekening yang diperoleh terdakwa dari live chat pada situs tersebut. Terdakwa mentransfer uang deposit dari rekening BCA 241189815 atas nama Ribobby milik terdakwa yang juga didaftarkan untuk menerima uang hasil permainan judi apabila menang ",pasal 27 ayat 2
"Bahwa tersangka bekerja di PT MUSIM MAS sejak Oktober 2014 sebagai staff officer dan sudah beberapa kali menjalani mutasi hingga akhirnya ditugaskan di Medan; Bahwa terdakwa sering bermain judi jenis online bersama ADE IRIANTO, SUPRIADI, EDI, STEVEN dan ROBI yang masing-masing mempunyai ID sendiri di website IBC.com; Bahwa STEVEN pernah menitip pasangan taruhan sebanhak 3 sampai 5 kali pada terdakwa, namun saat ini terdakwa sudah tidak pernah lagi berhubungan dengan ADE IRIANTO, SUPRIADI, EDI, STEVEN dan ROBI karena ADE IRIANTO, SUPRIADI, EDI, STEVEN dan ROBI sudah tidak lagi bekerja di PT MUSIM MAS; Bahwa tersangka melakukan perjudian secara online bersama dengan ADE ARIANTO sesame karyawan PT MUSIM MAS, SUPRIADI , STEVEN dan ROBY yang semuanya adalah mantan karyawan PT MUSIM MAS; Bahwa awalnya terdakwa mengakses atau membuka situs atau website IBC.com dan SBOBET.com menggunakan handphone merk Vivo Y26 warna putih milik terdakwa dari browsing internet, lalu mendapat situs www.vegas99.com lalu chatting meminta ID dan diberikan ID dan password yang diberikan di situs www.maxbet.com lalu untuk melakukan deposit atau mengisi saldo di ID terdakwa melakukan chatting di www.vegas99.com dan situs tersebut memberikan nomor rekening, setelah itu terdakwa melakukan transfer dengan jumlah yang terdakwa inginkan kemjudian baru diproses untuk menjadi saldo ID terdakwa. Bahwa terdakwa melakukan taruhan pertandingan judi sepak bola di situs sbobet.com sejak 2015 dan memiliki 6 (enam) ID website. Bahwa terdakwa sudah lebih dari 10 (sepuluh) kali melakukan deposit di judi www.sbobet.com, www.ibc.com dan www.vinegg.com dengan total keseluruhan deposit Rp. 10.000.000, (sepuluh juta rupiah) Bahwa terdakwa pernah menang atau sudah melakukan pencairan di website tersebut kurang lebih Rp. 2.000.000, sampai dengan Rp. 3.000.000,-; Bahwa terdakwa menggunakan rekening Bank Mandiri nomor rekening 105-00-1117017-6 atas nama terdakwa; Bahwa terdakwa menggunakan HP VIVO Y69 model 1714 IMEI Sim 1: 865569031504952, IMEI Sim 2: 865569031504945 warna putih dan nomor handphone yang terdakwa lakukan untuk melakukan perjudian online tersebut yaitu 082279182173 dan 082377375770; Bahwa pada Hari Jumat tanggal 12 Januari 2018 pada saat terdakwa melakukan klarifikasi dengan STEVANUS COLONNE sehubungn dengn tercampurnya minyak dengan air dalam tanki timbun di PT MUSIM MAS Jambi lalu tiba-tiba datang petugas kepolisian dari Polda Sumut yang berpakaian preman melakukan penangkapan terhadap terdakwa di kantor PT MUSIM MAS Jalan Yos Sudarso Km7,8 Tanjung Mulia Kec. Medan Deli Kota Medan Bahwa pada saat ditangkap barang bukti yang disita adalah 1 (satu) buah hp Vivo Y69 warna putih, 1 (satu) buah simcard No. 082279182173, 1 (satu) buah simcard No. 082377375770, 1 (satu) buah ATM BNI Taplus No rekening 5371760030104300, 1 (satu) buah ATM Bank Mandiri dengan No. 4097662819000616, 1 (satu) buah buku rekening tabungan BNI Taplus dengan No rekening 0507556665 KENDRY TANRI, 1 (satu) buah rekening tabungan Bank MAndiri dengan No 1050011170176 an. KENDRY TANRI Bahwa barang bukti yang disita dalam perkara ini yaitu 1 (satu) buah hp Vivo Y69 warna putih, 1 (satu) buah simcard No. 082279182173, 1 (satu) buah simcard No. 082377375770, 1 (satu) buah ATM BNI Taplus No rekening 5371760030104300, 1 (satu) buah ATM Bank Mandiri dengan No. 4097662819000616, 1 (satu) buah buku rekening tabungan BNI Taplus dengan No rekening 0507556665 KENDRY TANRI, 1 (satu) buah rekening tabungan Bank MAndiri dengan No 1050011170176 an. KENDRY TANRI, Bahwa selanjutnya terdakwa dan barang bukti dibawa ke Polda Sumut untuk diproses secara hukum",pasal 27 ayat 2
"Bahwa Terdakwa KRISTANTO PATAR SIMAMORA pada waktu dan tempat sebagaimana diatas, telah ditangkap oleh petugas kepolisian Polres Pelabuhan Tanjung Priok berdasarkan adanya laporan dari masyarakat sehubungan dengan tindak pidana perjudian jenis togel Singapura secara on line yang menggunakan media internet dengan menggunakan 1 (satu) unit Handphone merk Redmi 5A milik Terdakwa . Bahwa berawal pada bulan januari 2019 Terdakwa dengan menggunakan hp Terdakwa memasang aplikasi dari playstore yaitu UC Browser kemudian Terdakwa membuka aplikasi UC Browser tersebut dan mengetik “togel up” pada Url : Http://178.128.218.201/ dan selanjutnya Terdakwa mendaftar dengan nama akun Toto66 dan Password : kopral66, kemudian melakukan login/ masuk dan Terdakwa memasukkan deposit rata-rata sebesar Rp 50.000, (lima puluh ribu rupiah) ke rekening bank BCA An. RAMINEN dengan no Rek. 8691586901. Dan setelah Terdakwa melakukan login akan keluar peraturan permainan dan Terdakwa meng klik “saya setuju” untuk melanjutkan kemudian akan tampil pada layar pilihan permainan togel tersebut yaitu diantaranya ada PSCO, NEVADA, CAROLINADAY, BULLSEYE, SYDNEY, TOTO MACAU, SINGAPORE, HONGKONG dan lain-lain kemudian Terdakwa mengklik pada tulisan SINGAPORE dan selanjutnya memilih menu pada 4D, 3D, 2D yang artinya 4D adalah pasangan empat angka, 3D adalah pasangan tiga angka dan 2D adalah pasangan dua angka. Setelah memasukkan angka pasangan kemudian Terdakwa mengklik “BELI” dan selanjutnya setelah terkirim sekitar jam 17.45 Wib akun akan dibuka kembali oleh Terdakwa untuk melihat hasil angka pasangan yang menang/keluar. Bahwa jika pasangan 4 angka yang keluar maka hasil kemenangan tersebut langsung terkirim ke saldo deposit Terdakwa untuk setiap pasangan sebesar Rp 1.000, akan mendapatkan kemenangan uang sebesar Rp 3.000.000, (tiga juta rupiah), jika pasangan 3 angka yang keluar maka hasil kemenangan tersebut langsung terkirim ke saldo deposit Terdakwa untuk setiap pasangan sebesar Rp 1.000, akan mendapatkan kemenangan uang sebesar Rp 400.000, (empat ratus ribu rupiah), jika pasangan 2 angka yang keluar maka hasil kemenangan tersebut langsung terkirim ke saldo deposit Terdakwa untuk setiap pasangan sebesar Rp 1.000, akan mendapatkan kemenangan uang sebesar Rp 70.000, (tujuh puluh ribu rupiah). setelah itu Terdakwa memindahkan saldo deposit tersebut ke rekening Terdakwa dan Terdakwa dapat mengambil uang hasil kemenangan tersebut. Bahwa Terdakwa menerima pemasangan judi togel di sekitar jalan Tenggiri Kel. Tanjung Priok Jakarta Utara yang bertujuan untuk mendapatkan keuntungan Bahwa dalam permainan judi on line yang dilakukan Terdakwa , Terdakwa menggunakan peralatan berupa 1 (satu) buah Hand Phone merk Redmi 5A, dengan Imei 1 : 865394036061506, Imei 2 : 865394036061514 berikut Sim Card As no 085210232899, 1 (satu) buah buku rekening bank BCA no. rek. 0070268817 An. Terdakwa KRISTANTO PATAR SIMAMORA berikut dengan kartu ATM BCA no. 5307952010360338 yang digunakan Terdakwa untuk transfer pembayaran dan kemenangan dari pemain togel tersebut dan 3 (tiga) buah buku tulis yang digunakan Terdakwa untuk merumus prediksi angka-angka pasangan yang akan keluar. Bahwa Terdakwa bertindak sebagai pengecer yang selain memasang sendiri Terdakwa juga menerima pasangan angka judi togel dari orang lain dan teman teman Terdakwa dan dalam setiap pemasangan togel tersebut Terdakwa mendapatkan keuntungan sebesar 28 % (dua puluh delapan persen) dengan ketentuan minimal saldo yang ada dalam aplikasi tersebut sebesar Rp 50.000, (lima puluh ribu rupiah). Bahwa Terdakwa dalam melakukan permainan judi jenis togel Singapura on line tersebut tidak memiliki izin dari pihak yang berwenang sehingga Terdakwa ditangkap dan dibawa ke Polres Pelabuhan Tanjung Priok untuk diproses lebih lanjut.",pasal 27 ayat 2
"n dengan cara sebagai berikut : Bahwa awalnya saksi Safpe Tambatua Sinaga, S.Kom beserta petugas lainnya, yang sedang melaksanakan tugas OPS Maya Progo telah mendapatkan informasi dari masyarakat jika di daerah Playen terdapat praktek perjudian tebak angka nomor judi Hongkong dengan menggunakan sarana media elektronik berupa hand phone (HP) dengan cara sms. Bahwa selanjutnya setelah dilakukan penyelidikan pada hari Jumat tanggal 28 September 2018 sekitar jam 19.00 WIB oleh petugas, nomor hand phone yang menyediakan jasa praktek perjudian tersebut adalah nomor 087738158041 dan 087738812211 yang kemudian diketahui adalah nomor hand phone milik terdakwa. Dan selanjutnya petugas mengawasi gerak gerik terdakwa yang merupakan pemilik kedua nomor hand phone tersebut. Bahwa pada hari Sabtu tanggal 29 September 2018 sekitar jam 00.20 WIB, petugas yang telah mengawasi terdakwa selama sekitar 5 jam kemudian melakukan penangkapan terhadap terdakwa, dan setelah dilakukan penggeledahan ditemukan barang bukti berupa : a. 1 buah hand phone merk Samsung seri GT-E1200R dengan nomor IMEI 353124/06/047843/6 dengan nomor seluler XL 087738812211 milik terdakwa yang masih terdapat sms antara lain : SMS masuk dari Deta nomor 081804234544 pada tanggal 28/09/2018 pukul 23.30 WIB berisi ” Hd, ce, 7,x20 rb cek om ” SMS masuk dari DETA nomor 081804234544 pada tanggal 28/09/2018 pukul 23.30 WIB berisi ” Hd, cp,4,x20rb, c,7,x20rb ” Pesan yang tersimpan dalam konsep pesan bertuliskan ”Tp40,s35,dl100,d100,p120,t10,a50 b. 1 buah hand phone merk LG seri B220 warna hitam dengan nomor IMEI : 353028-08-102691-0 dengan nomor seluler XL 8773815804 c. Uang tunai sejumlah Rp. 705.000,- (tujuh ratus lima ribu rupiah) terdiri dari 6 lembar uang pecahan Rp. 100.000,-, 1 lembar uang pecahan Rp. 50.000,- , 5 lembar uang pecahan Rp. 10.000,- dan 1 lembar uang pecahan Rp. 5.000,-. Bahwa s uang Rp. 705.000,- (tujuh ratus lima ribu rupiah) adalah uang hasil penjualan judi togel Hongkong dan hasil penjualan ayam. Bahwa maksud dari isi sms yang ada dalam hand phone merk Samsung seri GT-E1200R dengan nomor IMEI 353124/06/047843/6 dengan nomor seluler XL 087738812211 milik terdakwa tersebut adalah merupakan kode singkatan yang digunakan dalam praktek penjualan/pembelian tebak angka ataupun tebak nomor judi Hongkong, dimana sms tersebut disingkat dengan menyebutkan nomor angka yang dibeli serta jumlah uang taruhannya, yaitu sebagai berikut : SMS masuk dari Deta nomor 081804234544 pada tanggal 28/09/2018 pukul 23.30 WIB berisi ” Hd, ce, 7,x20 rb cek om ”, maksudnya hadiah colok ekor angka 7 dikalikan Rp. 20.000,- , artinya Deta memberitahukan bahwa ada konsumen atau pembeli ada yang mendapatkan undian colok ekor angka 7 dengan pembelian Rp. 20.000,-. SMS masuk dari DETA nomor 081804234544 pada tanggal 28/09/2018 pukul 23.30 WIB berisi ” Hd, cp,4,x20rb, c,7,x20rb ”, maksudnya hadiah colok puluhan angka 4 dikalikan Rp. 20.000,- dan colok ekor angka 7 dikalikan Rp. 20.000,- , artinya Deta memberitahukan bahwa ada konsumen atau pembeli ada yang mendapatkan undian puluhan angka 4 dengan pembelian Rp. 20.000,- . Sedangkan ce ,7,x20rb” hanya menegaskan sms sebelumnya. Pesan yang tersimpan dalam konsep pesan bertuliskan ”Tp40,s35,dl100,d100,p120,t10,a50, maksudnya adalah ingkatan nama pembeli yang pada malam itu membeli tebak angka atau nomor judi Hongkong melalui terdakwa, anatra lain TP40 pembelian Topo total sebesar Rp. 40.000,-, S35 PEMBELIAN Sawabi/Hendi total sebesar Rp. 35.000,- , dl100 pembeli Sidol/Dul Rohman sebesar Rp. 100.000,-, p120 pembeli Ipul total sebesar Rp. 120.000,- , t10 pembeli Topo pijet total sebesar Rp. 10.000,- , a50 pembeli Antok total sebesar Rp. 50.000,-. Bahwa terdakwa menyediakan jasa pengecer togel Hongkong melalui media hand phone tersebut sejak sekitar bulan April 2018 dengan omzet sebesar Rp. 200.000,- (dua ratus ribu rupiah) sampai dengan Rp. 1.000.000,- (satu juta rupiah) dimana terdakwa memperoleh fee sebesar 10% dari omzet penjualan yang diberikan oleh Deta (DPO). Bahwa cara mengikuti judi Hongkong yang dilakukan terdakwa dilakukan dengan cara pembeli atau pemasang menghubungi terdakwa melalui sms dan menyebutkan angka pilihan dan jumlah uang yang dipasang oleh pembeli pada angka pilihan, dan setelah menerima sms tersebut maka terdakwa akan menjawab dengan ok kepada pembeli yang mengirim sms, dan selanjutnya terdakwa menghapus pesan sms yang masuk. Bahwa pada keesokan harinya pembeli menemui terdakwa dan menyerahkan uang tunai pembelian nomor judi hongkong kepada terdakwa, dan setelah nomor/angka sudah keluar maka terdakwa akan menghubungi pembeli melalui sms berisi nomor/angka. Bahwa judi nomor togel Hongkong yang dsediakan oleh terdakwa tersebut tidak ada ijin dari pihak yang berwenang dan bersifat untung-untungan, yaitu : Jika pembeli/pemasang menebak 2 nomor dengan pembelian Rp. 1.000,- akan mendapatkan Rp. 60.000,- Jika pembeli/pemasang menebak 3 nomor dengan pembelian Rp. 1.000,- akan mendapatkan mendapatkan Rp. 400.000,- Jika pembeli/pemasang menebak 4 nomor dengan pembelian Rp. 1.000,- akan mendapatkan mendapatkan Rp. 2.500.000,-",pasal 27 ayat 2
"Berawal pada hari Selasa tanggal 31 Juli 2018 sekira pukul 19.00 Wib Tim Cyber Dit. Reskrimsus Polda Bengkulu menerima informasi atau pengaduan dari masyarakat tentang adanya kegiatan judi toto gelap (Togel) secara online di Kota Bengkulu khusunya di seputaran Kel. Malabero Kec. Teluk Segara Kota Bengkulu kemudian tim Cyber melakukan penyelidikan dan mencari informasi tentang kegiatan judi togel online tersebut. Setelah mendapatkan data dan informasi yang didapat kemudian saksi MIRZA TRI YUNA PUTRA, S. Kom, saksi WISNU INDRA CAHAYA dan saksi EDMON DONOVAN menuju ketempat yang biasanya digunakan untuk melakukan kegiatan perjudian togel secara online. Sekitar pukul 21. 30 Wib di rumah makan Vinsen yang beralamat Jl. Pendakian No. 27 Rt. 12 Rw. 04 Kel. Malabero Kec. Teluk Segara Kota Bengkulu melihat aktifitas yang mencurigakan kemudian saksi MIRZA TRI YUNA PUTRA, saksi WISNU INDRA CAHAYA dan saksi EDMON DONOVAN masuk kedalam rumah makan tersebut dan terdapat kegiatan permainan judi togel secara online yang dilakukan saksi MESIPAL JULIYANSYAH Alias IPAL Bin UJANG MISRAN (Alm) dimana pada saat itu saksi MESIPAL JULIYANSYAH Alias IPAL Bin UJANG MISRAN (Alm) sedang berada di depan laptop yang diduga dipergunakan untuk mengakses dan bermain judi togel online tersebut. Bahwa terdakwa dalam melakukan kegiatan permainan judi togel secara online tersebut melalui website / situs www1.totobet.net dan website www3.totojitu18.com dimana kedua akun tersebut adalah milik terdakwa dan permainan judi togel secara online sejak 2015 hingga saat ini yang dilakukan dirumah terdakwa. Bahwa pertama kali yang terdakwa lakukan ketika ingin masuk atau bergabung kedalam website / situs www1.totobet.net dan website www3.totojitu18.com setelah itu terdakwa masuk kehalaman beranda dan dihalaman tersebut tersedia kolom mendaftar, kemudian terdakwa meng ”Klik” kolom ”daftar” selanjutnya terdakwa diharuskan membuat nama akun dan pasword yang akan di pergunakan untuk masuk kedalam website tersebut, setelah itu terdakwa diharuskan membuat email, kemudian langkah selanjutnya terdakwa diminta untuk memilik bank yang akan terdakwa pergunakan untuk bermain judi togel online dan terdakwa memasukkan nama pemilik rekening dan selanjutnya memasukkan nomor rekening, setelah semua data terisi barulah terdakwa dinyatakan selesai dan bergabung dalam permainan judi togel online yang di kelolah oleh website / situs www1.totobet.net dan website www3.totojitu18.com. Bahwa terdakwa rata-rata melakukan penyetoran deposit uang taruhan dalam permainan judi togel online tersebut yaitu antara Rp. 1.000.000,- (satu juta rupiah) sampai dengan Rp. 2.000.000,- (dua juta rupiah) dan terkadang jika peminat dan pasangan besar maka terdakwa akan mendepositkan uang terdakwa sebesar Rp. 4.000.000,- (empat juta rupiah) dan keuntungan yang terdakwa dapat dari permainan judi togel online tersebut sebesar 4 % (empat persen) dari jumlah uang taruhan atau uang pasangan setiap harinya ; Bahwa persentase keuntungan yang akan didapat oleh pemasang jika angka atau nomor pasangannya keluar adalah Pasangan 2 (dua) angka dikali Rp. 1.000 (seribu rupiah) akan menerima keuntungan sebesar Rp. 65.000,- (enam puluh lima ribu rupiah), Pasangan 3 (tiga) angka dikali Rp. 1.000 (seribu rupiah) akan menerima keuntungan sebesar Rp. 350.000,- (tiga ratus lima puluh ribu rupiah), Pasangan 4 (empat) angka dikali Rp. 1.000 (seribu rupiah) akan menerima keuntungan sebesar Rp. 2.500.000,- (dua juta lima ratus ribu rupiah);",pasal 27 ayat 2
