kronologi,pasal
"Berawal pada waktu dan tempat tersebut di atas terdakwa JUMARDI alias JUMARDI Bin H. BEDDU dengan menggunakan alat elektronik miliknya yaitu 1 (satu) unit handphone merek VIVO warna gold (emas) dengan tipe 1606 dengan nomer imei 1 1867211032293396 imei 2 867211032293388 dan nomer simcard yang terdaftar dalam akun facebook yaitu 085145936257 dengan nama akun facebook JONTRAFOLTA JUMARDIN dengan sengaja memposting 9 (sembilan) foto/gambar pekerjaan rehabilitasi jaringan irigasi akkajeng (bendungan) yang sedang rusak dengan tulisan yang mengandung arti penghinaan dan atau pencemaran nama baik “Bagaimana pendapatnya dinas terkait tengtang pekerjaan ini” ke dalam grup facebook BKKS (berita kejadian kabupaten soppeng) yang mana pada grup facebook tersebut dapat dilihat atau diakses oleh banyak orang dan dikomentari oleh salah satunya saksi Sainal Kasus dengan komentar “ setau saya sudah disuruh benahi pekerjaannya sama ppk PSDA,gak tau apakah sudah dibenahi atau tidak…” dan dibalas lagi komentar oleh terdakwa dengan tulisan “Alhamdulillah sampai sekarang belum ada perbaikan” Bahwa saksi korban ABD ASIS mengetahui atau melihat postingan terdakwa tersebut pada hari Sabtu tanggal 22 September 2018 sekitar pukul 22.00 wita di warung kopi Nesya Cabbenge setelah diberitahu dan diperlihatkan postingan terdakwa oleh saksi SUKRI alias SUKA. Bahwa atas postingan foto/gambar dan komentar terdakwa pada hari sabtu tanggal 22 September 2018 sekitar pukul 11.37 Wita tersebut tidaklah benar. saksi korban ABD ASIS merasa malu/dipermalukan dan dicemarkan nama baik juga reputasi CV. Lanyala Brothers, perusahaan saksi korban yang mengerjakan pekerjaan rehabilitasi jaringan irigasi akkajeng (bendungan) tersebut karena dengan perbuatan terdakwa memposting atau membagikan foto/gambar dengan komentar tersebut diatas ke grup facebook BKKS (berita kejadian kabupaten soppeng) tersebut membuat diketahui orang/khalayak banyak. Bahwa karena saksi korban ABD ASIS merasa terhina dan dicemarkan nama baiknya membuat saksi korban keberatan sehingga hal tersebut dilaporkan ke Pihak Kepolisian Resort Soppeng.",pasal 27 ayat 3
"Terdakwa Marita Sani pada hari Rabu, tanggal 06 Februari 2019 di kawasan Perumahan Perumahan Graha Bunder Asri Kab. Gresik hingga Jl. Dr. Wahidin Kab. Gresik telah membuat video dirinya sendiri yang direkam dengan menggunakan hand phone merk Oppo Joy warna putih IMEI 1 : 867496020290336, IMEI 2 : 867496020290328 ; Dalam video tersebut terdakwa Marita Sani melontarkan kata-kata diantaranya “Asaya Cuma mau bilang buat isteri-isteri pelaut, perwira, bintara di PELNI, saya cuma bilang satu hal jangan kebanyakan gaya, kenapa ? karena saya tahu betul gitu loh gaji suami kalian berapa, kalian bergaya dengan uang yang ndak seharusnya jadi milik kalian, yaaa saya tahu betul permainan suami-suami kalian di kapal seperti apa, jadi kalau kalian mau nyombong mikir pakek otak ya, kartu suami kalian semua itu ada ditangan saya, saya punya bukti seribu bukti untuk membuktikan korupsi semua di PELNI, saya tahu, jadi kalo isteri-isteri perwira mau gaya, mau songong mikir yaa, apalagi mau gaya depan gue, gue sikat loe, karena saya tahu kelakuan orang PELNI” kalimat selanjunya “jadi isteri-isteri perwira, bintara gak usah banyak gaya yaa, gak usah songong, gak usah banyak ngatur di kapal, gak usah berlagak kayak isteri jenderal yang seolah-olah kalian pemilik PELNI, kalian bukan siapa-siapa di PELNI saya gak perduli siapapun ya, siapapun di PELNI yang cari gara-gara dengan saya, saya sikat kalian satu per satu, saya gak perduli ya, kalian ganggu saya kalian saya sikat habis, jadi kalian isteri-isteri perwira, bintara gak usah banyak gaya, gak usah banyak sombong depan saya, kalian berani sombong didepan saya tak ludahin muka kamu, tak teriakkan didepan dirimu bahwa suamimu itu maling di PELNI oke, suami kalian maling di PELNI, uang yang kalian terima diluar rekening Mandiri itu sudah dipastikan uang haram tau, uang korupsi, kalian di PELNI bukan siapa-siapa, apalagi isteri perwira woo jangan coba-coba, kalian mau banyak gaya depan saya tak ludahin mukamu dan satu hal lagi sampek saya tahu ada yang memfitnah saya, satu orang saja ada fitnah saya, ada satu saja kata-kata fitnah saya, saya nggak segan-segan robek-robek mulutnya, tak permalukan, tak labrak suaminya di kapal, tak labrak isterinya sekalian, biar itu pelajaran telak buat kalian orang-orang dajjal di PELNI yaa Wassalamualaikum” ;",pasal 27 ayat 4
"Bahwa Terdakwa RAHMAT RUSTAM pada tanggal 24 Mei 2019, bertempat di rumah Terdakwa di Jl. Kota Bambu Selatan II No.3 Rt.008 Rw.008 Kelurahan Bambu Selatan, Kecamatan Palmerah Jakarta Barat Provinsi DKI Jakarta, atau setidak-tidaknya pada suatu tempat yang masih termasuk dalam daerah Hukum Pengadilan Negeri Jakarta Barat, dengan sengaja dan tanpa hak mendistribusikan dan/atau mentransmisikan dan/atau membuat dapat diaksesnya informasi elektronik dan/atau dokumen elektronik yang memiliki muatan pemerasan dan/atau pengancaman. Perbuatan tersebut dilakukan oleh Terdakwa dengan cara sebagai berikut: Bahwa awalnya Terdakwa RAHMAT RUSTAM memiliki akun facebook atas nama Mat Rahmat Rustam dengan Uniform Resource Locator (URL) : https://www.facebook.com/maaic. Bahwa pada tanggal 24 Mei 2019, terdakwa mengirimkan/memposting gambar dan tulisan ke dalam akun facebook milik nya dengan URL: https://www.facebook.com/photo.php?fbid= 101556682177978509&set=a.493005113508&type=3&theater, dengan kata kata/kalimat antara lain: Mari Bangsaku tangkap ini manusia hidup atau mati, adakah yang sanggup bunuh ini manusia dan penggal kepalanya disertai foto Sdr. Tito Karnavian selaku Kapolri. Bahwa kata-kata/kalimat yang Terdakwa tuliskan/posting dalam akun facebook terdakwa tersebut dari segi bahasa sebagaimana keterangan ahli Andika Dutha Bachari, S.PD.,MHum (ahli bahasa) merupakan kalimat imperative yang menyatakn seruan berupa ajakan menangkap orang yang ada digambar yaitu Kapolri Tito karnavian dan secara implisit kalimat tersebut bermakna janji untuk melakukan tindakan kekerasan terhadap Kapolri yakni ancaman terhadap Kapolri. Bahwa tulisan dan gambar/foto tersebut terdakwa kirimkan ke dalam akun facebook Terdakwa dengan menggunakan media elektronik berupa handphone merek iphone 5S warna putih milik Terdakwa. Bahwa kata-kata/tulisan dalam wall/dinding akun facebook milik Terdakwa tersebut dapat dibaca oleh orang lain ",pasal 27 ayat 4
"Bahwa terdakwa ditangkap pada hari ini Rabu tanggal 05 September 2018 sekira jam 17.30 wib di daerah Tebon Gede Klaten, dimana terdakwa telah mengirimkan pesan singkat/ SMS ke nomor call center/ hotline RSI Sultan Agung dengan nomor 085100412424 dengan menggunakan 1 (satu) HP merk Nokia type C2 warna hitam dengan no HP 083893122327 milik terdakwa pada hari Selasa tanggal 04 September 2018 sekira jam 13.30 WIB dengan isi smsnya “AWAS HATI-HATI ADA BOM DI DALAM MASJID SULTAN AGUNG PAK “, , “ SURUH SEMUAH ORANG YNG ADA DI DALAM MASJID AGUNG KELUAR SEMUAH NYAH SEBELUM TERLAMBAT DAN MENYESAL “ , “ WAKTU TINGGAL SATU JAM LAGI “ , “ JANGAN COBA2 TLPN SAYA “ , “ LAIN KALI BAPA HARUS SOPAN DAN BAIK MELAYANI PASIEN YNG MAU BEROBAT KE SITU “ , “ WAKTU DURASI LEDAK AKTIV BOM HANYA SATU SETENGAH JAM PAK “ , “ TERSERAH ANDA MAU PERCYA ATW TIDAK SAMA SAYA” sebagaimana Berita Acara Pemeriksaan Laboratoris Kriminalistik No.: 1894/FKF/2018 tanggal 20 September 2018 Jenis bidang pemeriksaan Komputer Forensik.  Bahwa terdakwa pada hari Selasa tanggal 04 September 2018 sekira jam 11.30 WIB datang ke RSI Sultan Agung Semarang untuk berobat karena perut terdakwa sakit, namun terdakwa merasa tidak dilayani dengan baik.  Bahwa perbuatan terdakwa mengakibatkan perasaan panik, takut, dan resah yang dialami oleh pasien dan karyawan RSI Sultan Agung Semarang. Bahwa perbuatan terdakwa sebagaimana diatur dan diancam pidana dalam Pasal 45 ayat (4) UU No.19 Tahun 2016 perubahan atas UU No.11 Tahun 2008 tentang Informasi dan Transaksi Elektronik",pasal 27 ayat 4
"Bahwa ia Terdakwa INA YUNIARTI, pada hari Jumat tanggal 10 Mei 2019 sekitar pukul 11.00 Wib atau setidak-tidaknya pada bulan Mei tahun 2019 bertempat di depan Kantor Badan Pengawas Pemilu Rl (BAWASLU Rl) JL. M.H. Thamrin Kota Jakarta Pusat atau setidaknya pada suatu tempat lain yang masih termasuk dalam daerah hukum Pengadilan Negeri Jakarta Pusat, telah dengan sengaja dan tanpa hak mendistribusikan dan/atau mentransmisikan dan/atau membuat dapat diaksesnya Informasi Elektronik dan/atau dokumen elektronik yang memiliki muatan pemerasan dan/atau ancaman. ",pasal 27 ayat 4
"Bahwa ia terdakwa AGUS RIYAN SYAHPUTRA Als RYAN pada hari Senin tanggal 05 Agustus 2019 sekira pukul 11.30 WIB atau pada suatu waktu lain dalam bulan Agustus 2019 atau setidak-tidaknya masih dalam tahun 2019, bertempat di Jalan Musyawarah Lingkungan II Paya Mabar Rel Kelurahan Paya Mabar Kecamatan Stabat Kabupaten Langkat atau di suatu tempat dalam daerah hukum Pengadilan Negeri Stabat yang masih dalam daerah hukum Pengadilan Negeri Stabat, dengan sengaja dan tanpa hak mendistribusikan dan/atau mentransmisikan dan/atau membuat dapat diaksesnya Informasi Elektronik dan/atau Dokumen Elektronik yang memiliki muatan pemerasan dan/atau pengancaman kepada saksi korban DITA PERMATA SARI",pasal 27 ayat 4
"Bahwa ia terdakwa SUWOTO Bin (Alm) WONGSO MUN pada hari KAMIS tanggal 17 MEI 2018 sekitar pukul 11.33 Wib dan 11.35 Wib atau setidak-tidaknya pada waktu lain dalam bulan MEI tahun 2018 bertempat di HP (handphone) dengan nomor HP 082 337 188 267 milik saksi DJOKO WIDAGDYO, ST.,SH.,MM yang berada di Jl. Sumargo Gang Anggrek 36 RT.005/ RW.003, Kelurahan Tlogoanyar, Kec. Kab. Lamongan atau setidak-tidaknya pada suatu tempat lain yang masih termasuk wilayah hukum Pengadilan Negeri Lamongan yang berwenang memeriksa dan mengadili perkara ini, “Dengan sengaja dan tanpa hak mendistribusikan dan/atau mentransmisikan dan/atau membuat dapat diaksesnya Informasi Elektronik dan/atau Dokumen Elektronik yang memiliki muatan pemerasan dan/ atau pengancaman sebagaimana dimaksud dalam Pasal 27 ayat (4)",pasal 27 ayat 4
"Bahwa berawal pada hari Selasa tanggal 27 Agustus 2019 sekitar pukul 07.14 Wit terdakwa ISHAK SAMUEL AYER Alias ISHAK Alias CAKEN mengunggah status atau membuat dapat diaksesnya infomasi elektronik atau dokumen elektronik berupa tulisan yang berisi Manokwari, Sorong dan sekitarnya Kalau Internet masih diblokir.. Usul saya kam kumpul massa baru bakar kantor infokom kah kominfo kh apa itu biar tdk ada jaringan internet sekalian Ksi hangus mobil2 telkomsel kh itu juga biar tdk usah beli2 pulsa jg.. dengan perangkat teknologi atau sistem elektronik menggunakan Handphone merk Samsung Galaxy A50 dengan nomor Kartu SIM 085298085498 milik terdakwa melalui media sosial atau akun Facebook dengan nama akun ISHAK SAMUEL AYER AWOM yang dapat dibaca atau diakses oleh orang lain yang memiliki muatan pengancaman yaitu mengajak orang lain untuk membakar kantor Infokom atau Kominfo dan mobil Telkomsel sehingga orang lain yang dapat membaca atau mengakses informasi elektronik atau dokumen elektronik berupa tulisan yang diunggah oleh terdakwa dapat menimbulkan rasa benci atau terprovokasi untuk melakukan perbuatan mencelakakan atau menyusahkan orang lain atau pihak lain dalam hal ini pihak kantor Infokom/Kominfo dan Tekomsel; Bahwa pada saat terdakwa mengunggah status Manokwari, Sorong dan sekitarnya Kalau Internet masih diblokir.. Usul saya kam kumpul massa baru bakar kantor infokom kah kominfo kh apa itu biar tdk ada jaringan internet sekalian. Ksi hangus mobil2 telkomsel kh itu juga biar tdk usah beli2 pulsa jg.. kondisi internet di Kabupaten Teluk Bintuni dalam keadaan baik sehingga seluruh masyarakat di Kabupaten Teluk Bintuni tidak mempunyai masalah pada koneksi internet yang mana terdakwa mengupload status di Facebook milik terdakwa dengan menggunakana User ID/Akun Facebook menggunakan nama terdakwa dan untuk mengaktifkan Facebook tersebut memakai Pasword yang hanya diketahui oleh Terdakwa sendiri yaitu dengan memakai data kuota internet pada Provider Telkomsel dengan menggunakan alat Telekomunikasi berupa Hand Phone merk Samsung Galaxy A50 yang memakai kartu telepon dari Telkomsel dengan Nomor Kartu 085298085498; Bahwa terdakwa ISHAK SAMUEL AYER Alias ISHAK Alias CAKEN sengaja mengunggah status atau membuat dapat diaksesnya infomasi elektronik atau dokumen elektronik berupa tulisan tersebut sehingga dapat dibaca atau diakses oleh orang lain tanpa hak atau ijin dari Pemerintah. ",pasal 27 ayat 4
"Bahwa terdakwa ISHAK SAMUEL AYER Alias ISHAK Alias CAKEN, pada waktu dan tempat sebagaimana diuraikan dalam dakwaan kesatu, dengan sengaja dan tanpa hak, menyebarkan informasi yang ditujukan untuk menimbulkan rasa kebencian atau permusuhan individu dan/atau kelompok masyarakat tertentu berdasarkan atas suku, agama, ras, dan antar golongan (SARA), yang dilakukan terdakwa dengan cara-cara sebagai berikut: Bahwa berawal pada hari Selasa tanggal 27 Agustus 2019 sekitar pukul 07.14 Wit terdakwa ISHAK SAMUEL AYER Alias ISHAK Alias CAKEN telah menyebarkan informasi melalui Media Sosial Facebook dengan nama akun ISHAK SAMUEL AYER AWOM yang berisi tulisan Manokwari, Sorong dan sekitarnya Kalau Internet masih diblokir.. Usul saya kam kumpul massa baru bakar kantor infokom kah kominfo kh apa itu biar tdk ada jaringan internet sekalian. Ksi hangus mobil2 telkomsel kh itu juga biar tdk usah beli2 pulsa jg.. menggunakan Handphone merk Samsung Galaxy A50 dengan nomor Kartu SIM 085298085498 milik terdakwa yang ditujukan kepada masyarakat Papua yang berada di Manokwari, Sorong dan sekitarnya untuk timbul rasa kebencian atau permusuhan kepada orang lain atau pihak lain dalam hal ini pihak Infokom/Kominfo dan pihak Telkomsel; Bahwa pada saat terdakwa mengunggah status Manokwari, Sorong dan sekitarnya Kalau Internet masih diblokir.. Usul saya kam kumpul massa baru bakar kantor infokom kah kominfo kh apa itu biar tdk ada jaringan internet sekalian. Ksi hangus mobil2 telkomsel kh itu juga biar tdk usah beli2 pulsa jg.. kondisi internet di Kabupaten Teluk Bintuni dalam keadaan baik sehingga seluruh masyarakat di Kabupaten Teluk Bintuni tidak mempunyai masalah pada koneksi internet yang mana terdakwa mengupload status di Facebook milik terdakwa dengan menggunakana User ID/Akun Facebook menggunakan nama terdakwa dan untuk mengaktifkan Facebook tersebut memakai Pasword yang hanya diketahui oleh Terdakwa sendiri yaitu dengan memakai data kuota internet pada Provider Telkomsel dengan menggunakan alat Telekomunikasi berupa Hand Phone merk Samsung Galaxy A50 yang memakai kartu telepon dari Telkomsel dengan Nomor Kartu 085298085498; Bahwa terdakwa ISHAK SAMUEL AYER Alias ISHAK Alias CAKEN sengaja menyebarkan informasi berupa tulisan tersebut untuk timbul rasa kebencian atau permusuhan individu atau kelompok di dalam masyarakat tanpa hak atau ijin dari Pemerintah.",pasal 27 ayat 4
"Awalnya terdakwa DIKCY SESARDO RIFKI AJI alias BANTIAN RIFKI AJI yang berstatus sebagai narapidana di Lembaga Pemasyarakatan berkenalan dengan saksi IDA ROYANI melalui akun media sosial selanjutnya terdakwa secara terus menerus melakukan komunikasi melalui whatsapp dengan menggunakan sebuah handphone merk Samsung seri J3 dengan simcard nomor 081391089213 dan 0895377990786 . Setelah terdakwa merasakan hubungannya dengan saksi IDA ROYANI semakin dekat kemudian terdakwa meminta agar saksi IDA ROYANI mengirimkan foto dan video berupa gambar saksi IDA ROYANI dalam keadaan bugil/telanjang dan selanjutnya saksi IDA ROYANI memenuhi permintaan terdakwa dengan mengirimkan gambar berupa foto dan video saksi IDA ROYANI dalam keadaan bugil/telanjang dan setelah terdakwa menerima foto dan video tersebut kemudian terdakwa menyimpannya di dalam memori eksternal milik terdakwa ; Bahwa setelah terdakwa menyimpan foto dan video tersebut kemudian terdakwa mengirimkan pesan melalui whatsapp kepada saksi IDA ROYANI dengan mengatakan kalau terdakwa sedang mengalami musibah sehingga membutuhkan uang untuk itu terdakwa minta agar saksi IDA ROYANI mengirimkan sejumlah uang kepada terdakwa dan apabila saksi IDA ROYANI tidak mengirimkan uang kepada terdakwa maka foto dan video berupa gambar saksi IDA ROYANI dalam keadaan bugil/telanjang akan disebarluaskan melalui media sosial dan oleh karena saksi IDA ROYANI merasa ketakutan dengan perkataan terdakwa tersebut akhirnya saksi IDA ROYANI mengirimkan sejumlah uang secara bertahap sehingga mencapai jumlah Rp. 32.000.000, (Tiga puluh dua juta rupiah). Akibat perbuatan terdakwa tersebut, saksi IDA ROYANI merasa dirugikan secara materiil sejumlah Rp. 32.000.000, (Tiga puluh dua juta rupiah) serta mengalami tekanan batin atas tersebarnya foto korban dalam keadaan bugil di media social. Bahwa pesan whatsapp yang telah terdakwa kirimkan kepada saksi IDA ROYANI tersebut adalah informasi elektronik dan / atau doumen elektronik yang memiliki muatan pemerasan dan/atau pengancaman.",pasal 27 ayat 4
"Bahwa ia Terdakwa SUMARNO ALS ENOK BIN (ALM) REJO pada hari dan tanggal yang tidak dapat diingat lagi Bulan April Tahun 2019 sampai dengan bulan Desember Tahun 2019 atau setidak-tidaknya pada suatu waktu pada tahun 2019 bertempat di Dukuh Jenar Rt 16 Rw 03 Desa Cileng Kecamatan Poncol Kabupaten Magetan Propinsi Jawa Timur atau setidak-tidaknya pada suatu tempat yang masih termasuk dalam daerah hukum Pengadilan Negeri Magetan berwenang mengadili, “dengan sengaja dan tanpa hak mendistribusikan dan/atau mentransmisikan dan/ atau membuat dapat diaksesnya Informasi Elektronik dan/ atau Dokumen Elektronik yang memiliki muatan pemerasan dan/atau pengancaman, jika beberapa perbuatan perhubungan, sehingga dengan demikian harus dipandang sebagai satu perbuatan berlanjut”",pasal 27 ayat 4
"Bahwa ia Terdakwa INA YUNIARTI, pada hari Jumat tanggal 10 Mei 2019 sekitar pukul 11.00 Wib atau setidak-tidaknya pada bulan Mei tahun 2019 bertempat di depan Kantor Badan Pengawas Pemilu Rl (BAWASLU Rl) JL. M.H. Thamrin Kota Jakarta Pusat atau setidaknya pada suatu tempat lain yang masih termasuk dalam daerah hukum Pengadilan Negeri Jakarta Pusat, telah dengan sengaja dan tanpa hak mendistribusikan dan/atau mentransmisikan dan/atau membuat dapat diaksesnya Informasi Elektronik dan/atau dokumen elektronik yang memiliki muatan pemerasan dan/atau ancaman.",pasal 27 ayat 4
"Berawal terdakwa yang merupakan pacar saksi korban mendengar bahwa saksi korban akan menikah dengan laki-laki bernama MUDIN, sehingga terdakwa tidak menerima hal itu, kemudian pada hari Minggu tanggal 1 Juli 2018 sekitar jam 20.04 wita, disaat saksi korban sedang bermain handphone di kamarnya, tiba-tiba saksi korban mendapatkan pesan melalui akun media sosial WA(WhasApp) dari terdakwa dengan alat berupa handphone pribadi milik dari terdakwa yaitu handphone merek Oppo Neo 7 warna hitam dengan nomor 0852-5604-8334 kepada nomor WA(WhasApp) milik dari saksi korban dengan nomor 0821-9041-6655, setelah saksi korban membuka pesan (WhasApp) tersebut dari terdakwa berisikan kata-kata dengan mengatakan "" kta mbunuh ngana ski skli kta pehati deng ngana ini "" kemudian pada sekitar jam 20.13 wita tersangka mengirim pesan (WhasApp) kepada saksi korban berisikan kata-kata "" manyasal kta tidak bbunuh pa ngana uti "" kemudian pada sekitar jam 20.14 wita tersangka mengirim pesan (WhasApp) lagi pada saksi korban berisikan kata-kata "" Kita mo kase mati ngna uti karna gara-gara ngana semua ini jadi begini "" ; Akibat perbuatan terdakwa, saksi korban merasa takut dan jiwa saksi korban merasa terancam.",pasal 27 ayat 4
"Bahwa terdakwa Muh. Rafli Alias Cako Bin Kamaruddin pada hari dan tanggal yang tidak dapat dipastikan lagi dalam bulan Februari 2019 atau pada suatu waktu dalam tahun 2019, bertempat Rumah Tahanan Negara (Rutan) Klas II B Masamba Luwu Utara atau pada suatu tempat yang masih termasuk dalam daerah hukum Pengadilan Negeri Masamba Luwu Utara, “dengan sengaja dan tanpa hak mendistribusikan dan/atau mentransmisikan dan/atau membuat dapat diaksesnya informasi elektronik dan/atau dokumen elektronik yang memiliki muatan pemerasan dan/atau pengancaman sebagaimana dimaksud dalam Pasal 27 Ayat (4)",pasal 27 ayat 4
"Bahwa ia terdakwa I TIRZA LUMINTANG Alias ICA bertindak sendiri sendiri maupun bersama sama dengan terdakwa II GABRIELLA MONALISA YAKOBUS Alias BELLA pada hari dan tanggal yang sudah tidak dapat diingat lagi Bulan April 2019 sampai dengan bulan Mei 2019 atau setidak-tidaknya pada waktu lain dalam Tahun 2019, bertempat di Kabupaten Manokwari, Propinsi Papua Barat atau setidak-tidaknya pada suatu tempat yang masih termasuk dalam daerah hukum Pengadilan Negeri Manokwari yang berwenang untuk memeriksa dan mengadili perkara ini, yang melakukan, menyuruh melakukan dan turut serta melakukan, Setiap orang yang dengan sengaja dan tanpa hak mendistribusikan dan/atau mentransmisikan dan/atau membuat dapat diaksesnya informasi Elektronik dan/atau dokumen Elektronik yang memiliki muatan pemerasan dan/atau pengancaman",pasal 27 ayat 4
"Bahwa terdakwa DENNY JUNIARDI BIN MAHDINI AHMAD ZAINI pada hari dan tanggal yang sudah tidak dapat diingat lagi antara bulan November dan Desember tahun 2018 atau setidak-tidaknya pada suatu waktu dalam tahun 2018, bertempat di Lembaga Pemasyarakatan Klas II A Palangka Raya, Jalan Cilik Riwut Km 2,5 Kelurahan Palangka Kecamatan Jekan Raya Kota Palangka Raya Propinsi Kalimantan Tengah atau setidak-tidaknya pada suatu tempat yang masih termasuk dalam daerah hukum Pengadilan Negeri Palangka Raya, yang berwenang memeriksa dan mengadili perkaranya, dengan maksud untuk menguntungkan diri sendiri atau orang lain secara melawan hukum dengan ancaman pencemaran baik dengan lisan maupun tulisan, atau dengan ancaman akan membuka rahasia, memaksa seorang supaya memberikan barang sesuatu yang seluruhnya atau sebagian kepunyaan orang itu atau orang lain, atau supaya membuat hutang atau menghapuskan piutang",pasal 27 ayat 4
"Bahwa Ia terdakwa TAMBOK LAMHOT DAVID pada suatu waktu diantara tanggal 24 Oktober 2016 sampai dengan tanggal 30 Oktober 2016 atau setidak-tidaknya pada suatu waktu tertentu yang masih termasuk dalam tahun 2016, bertempat di beberapa tempat antara lain di Pulo Gerbang Permai Blok A 1/1 Rt. 05/010 Kel. Pulogebang Kec. Cakung Jakarta Timur, Cluster Aralia Blok HY No. 41 No. 10 Harapan Indah Bekasi Utara Bekasi atau pada tempat diketahuinya perbuatan tersangka oleh saksi korban di WTC Mangga Dua Jakarta Utara, sehingga Pengadilan Negeri Jakarta Utara berwenang untuk mengadili perkara ini, dengan sengaja dan tanpa hak mendistribusikan dan/atau mentransmisikan dan/atau membuat dapat diaksesnya Informasi Elektronik dan/atau Dokumen Elektronik yang memiliki muatan pemerasan dan atau pengancaman",pasal 27 ayat 4
"Bahwa ia terdakwa AGUS RIYAN SYAHPUTRA Als RYAN pada hari Senin tanggal 05 Agustus 2019 sekira pukul 11.30 WIB atau pada suatu waktu lain dalam bulan Agustus 2019 atau setidak-tidaknya masih dalam tahun 2019, bertempat di Jalan Musyawarah Lingkungan II Paya Mabar Rel Kelurahan Paya Mabar Kecamatan Stabat Kabupaten Langkat atau di suatu tempat dalam daerah hukum Pengadilan Negeri Stabat yang masih dalam daerah hukum Pengadilan Negeri Stabat, dengan sengaja dan tanpa hak mendistribusikan dan/atau mentransmisikan dan/atau membuat dapat diaksesnya Informasi Elektronik dan/atau Dokumen Elektronik yang memiliki muatan pemerasan dan/atau pengancaman kepada saksi korban DITA PERMATA SARI",pasal 27 ayat 4
"Menyatakan Terdakwa SISCA DEWI HERMAWATI secara sah dan menyakinkan terbukti bersalah melakukan tindak pidana “yang dengan sengaja dan tanpa hak mendistribusikan dan/atau mentransmisikan dan/atau membuat dapat diaksesnya Informasi Elektronik dan/atau Dokumen Elektronik yang memiliki muatan pemerasan dan/atau pengancaman sebagaimana dimaksud dalam Pasal 27 Ayat (4) yaitu Setiap Orang dengan sengaja dan tanpa hak mendistribusikan dan/atau mentransmisikan dan/atau membuat dapat diaksesnya Informasi Elektronik dan/atau Dokumen Elektronik yang memiliki muatan pemerasan dan/atau pengancaman, dimana beberapa perbuatan yang harus dipandang sebagai perbuatan berlanjut",pasal 27 ayat 4
"Bahwa mereka Terdakwa yakni Terdakwa I TOMI MUTIARA Bin ENCENG MIMBAR Terdakwa II WAGI ABDUL WAHID Bin ENDANG SUTISMAN, Terdakwa III NANDANG SUBHANA Bin DIRON, Terdakwa IV HERU NUGRAHA Alias HERU Bin MI’AN, Terdakwa V AISAH Binti ASEP II, bertindak secara bersama-sama atau sendiri-sendiri,pada hari Senin tanggal 24 Juni 2019 dan pada hari Selasa tanggal 25 Juni 2019 atau setidak-tidaknya pada bulan Juni 2019 atau setidak-tidaknya dalam Tahun 2019, bertempat di Lapas Kelas II B Tasikmalaya Jl.Otista No.01 Kota Tasikmalaya, di Anjungan Tunai Mandiri (ATM) BCA Jalan H. Z Mustopa Kota Tasikmalaya, atau setidak-tidaknya terjadi di suatu tempat yang masih termasuk daerah hukum Pengadilan Negeri Tasikmalaya, secara bersama-sama sebagai orang yang melakukan, yang menyuruh melakukan atau yang turut serta melakukan perbuatan itu, yang dengan sengaja dan Tanpa hak, mendistribusikan dan/atau mentransmisikan dan/atau membuat dapat diaksesnya Informasi Elektronik dan/atau Dokumen Elektronik yang memiliki muatan pemerasan dan/atau pengancaman",pasal 27 ayat 4
"Bahwa ia terdakwa ANASTASYA BULURDITTY Alias AIS pada hari Minggu tanggal 20 Mei 2018 atau setidak-tidaknya masih dalam waktu pada tahun 2018, bertempat di bengkel mebel di Kompleks Bukit Duri, Kelurahan Saumlaki, Kecamatan Tanimbar Selatan Kabupaten Maluku Tenggara Barat atau setidak-tidaknya pada suatu tempat yang masih termasuk dalam daerah hukum Pengadilan Negeri Saumlaki yang berwenang memeriksa dan mengadili perkara ini,“dengan sengaja dan tanpa hak mendistribusikan dan/atau mentransmisikan dan/atau membuat dapat diaksesnya Informasi Elektronik dan/atau Dokumen Elektronik yang memiliki muatan pemerasan dan/atau pengancaman”",pasal 27 ayat 4
