kronologi,pasal
"Bahwa terdakwa ANSAR AMIN pada hari Senin tanggal 30 Juli 2018 sekitar jam 22.00 wita, atau setidak-tidaknya pada waktu-waktu lain dalam tahun 2018 bertempat di Hotel Agraha Jalan Andalas Kota Makassar atau setidaktidaknya pada tempat-tempat lain yang masih termasuk dalam daerah hukum Pengadilan Negeri Makassar, Dengan sengaja dan tanpa hak Menyebarkan informasi Yang ditujukan untuk menimbulkan rasa kebencian atau permusuhan individu dan/atau kelompok masyarakat tertentu berdasarkan atas Suku, Agama, Ras, dan Antar golongan (SARA) sebagaimana dimaksud dalam pasal 28 Ayat (2) yang dilakukan oleh terdakwa dengan cara sebagai berikut: Bahwa pada waktu dan tempat tersebut diatas, berawal ketika saksi ADAM JORDAN sedang online/menggunakan media social melalui handphone merek OPPO A37f warna dengan no. IMEI 1 863441034892655 dan IMEI 2 863441034892648 milik terdakwa di dalam kamar hotel Agraha jln. Andalas Makassar tiba-tiba saksi ADAM JORDAN melihat saksi ANDI SANDI RAJENDRA AP meloncat-loncat di tempat tidur di kamar hotel Agraha yang mana posisi pintu kamar dalam keadaan terbuka lebar, lalu saksi ADAM JORDAN berinisiatif untuk merekamnya dengan menggunakan handphone milik terdakwa tersebut. Bahwa tahu dan sadar kalau saksi ANDI SANDI RAJENDRA AP sedang di rekam/video melaui hanphone merek OPPO A37f warna putih dengan no. IMEI 1 863441034892655 dan IMEI 2 863441034892648 oleh saksi ADAM JORDAN, lalu saksi ANDI SANDI RAJENDRA AP langsung berkata-kata/ kalimat dengan nada keras ""SEMUA PEMAINNYA SINJAI TAILASO UNTUK PARA PEMAIN SINJAI TAILASOMU SEMUA ANAK SINJAI TAILASO SINJAI TAILASO"" yang di ikuti pula oleh saksi MUHAMMAD RIVAI dengan juga berucap ""01 OIOI MENANG KITORANG NA MENANG"" sambil memberikan isyarat dengan menunjukkan jari tengah dan memukul-mukul pantat yang disaksikan juga oleh saksi ANSAR AMIN, dimana saksi ANDI SANDI RAJENDRA AP dan saksi MUHAMMAD RIVAI melakukan hal tersebut karena benci dengan anak-anak yang berasal dari daerah Sinjai sebab sering menyinggung saksi ANDI SANDI RAJENDRA AP dan teman-temannya yang berasal dari daerah Pasang Kayu dengan bahasa daerahnya yaitu Bugis, setelah semua orang di dalam kamar hotel tersebut diam, saksi ADAM JORDAN mematikan rekaman video tersebut dan meletakan handphone tersebut di depan TV kemudian saksi ADAM JORDAN meninggalkan kamar menuju pantai losari bersama teman-temannya dimana video tersebut berdurasi waktu selama 32 (tiga puluh dua) detik. Bahwa Terdakwa dan saksi ADAM JORDAN, saksi MUHAMMAD RIVAI serta saksi ANDI SANDI RAJENDRA AP mengerti kata "" TAILASO"" yang sering juga diucapkan TELASO merupakan suatu kata makian terhadap laki-laki karena dalam bahasa Makassar LASO berarti alat kelamin laki- laki Tai sendiri berarti kotoran, Jadi TAILASO berarti kotoran alat kelamin laki-laki. Apabila kata tersebut ditujukan kepada laki-laki maka itu merupakan suatu makian dan juga pelecehan terhadap laki-laki tersebut; Bahwa Sinjai adalah merupakan sebuah daerah yang terletak di bagian Timur kearah Tenggara wilayah Provinsi Sulawesi Selatan dan notabene Etnis Bugis; Bahwa tanpa sepengetahuan dan seizin saksi ADAM JORDAN, saksi MUHAMAD RIVAI serta saksi ANDI SANDI RAJENDRA AP pada hari Senin tanggal 30 Juli 2018 sekira pukul 22.00 wita video yang di buat saksi ADAM JORDAN tersebut oleh terdakwa di unggah/di sebar melaui konten group Whatsapp (WA) dengan nama (Class I) DKKP'BAROMBONG dengan cara terlebih dahulu terdakwa membuka aplikasi Galeri lalu membuka Video selanjutnya video tersebut di kirim/bagikan kedalam grup (Class I) DKKP'BAROMBONG dan terdakwa adalah anggota grup (Class I) DKKP'BAROMBONG dengan akun Whatsapp ANSAR JEON, adapun No Handphone yang teregister dalam akun tersebut adalah 082293573342 dan hanya terdakwa yang menggunakan akun Whatsapp tersebut serta tidak pernah memberikan akses kepada siapapun untuk menggunakan akun Whatsapnya; ",pasal 28 ayat 2
"Bahwa ia terdakwa MUHAMMAD AUFAR AFDILLAH pada hari Rabu tanggal 08 Mei 2019 sekitar pukul 16.15 wita atau setidak-tidaknya pada waktuwaktu lain dalam Tahun 2019 bertempat di Rumah Kos-Kosan terdakwa yang berada di lantai 1 No.1 Jalan Adhyaksa II Makassar atau setidak-tidaknya pada tempat lain yang masih termasuk dalam daerah Hukum Pengadilan Negeri Makassar, ia terdakwa dengan sengaja menyiarkan berita atau pemberitaan bohong yang menimbulkan keonaran dikalangan rakyat, perbuatan mana terdakwa lakukan dengan cara sbb : Bahwa berawal ketika terdakwa MUHAMMAD AUFAR memasukkan postingan di akun facebooknya ovarbzink @yahoo.co.id dengan kalimat “Kami tidak perlu capek menunggu kesiapan KPU karena semua juga sia “ Karena kami jauh lebih siap untuk PEOPLE POWER tanggal 20-22 Mei 2019. Diperkirakan memakan 200 korban jiwa nanti” dengan tujuan untuk mengajak orang-orang yang membaca postingan tersebut untuk ikut turun pada tanggal 20-22 Mei 2019 ketika hasil perhitungan suara pemilu 2019 diumumkan yang oleh KPU dan untuk menyuarakan keadilan atas kecurangan yang dilakukan KPU. Bahwa terdakwa MUHAMMAD AUFAR melakukan postingan kalimat tersebut diatas pada akun facebook milik terdakwa dengan penuh kesadaran sendiri tanpa paksaan atau suruhan dari orang lain yang mana kalimat tersebut adalah berita atau pemberitahuan bohong yang dapat menimbulkan kegelisahan dan menggoncangkan hati penduduk yang jumlahnya banyak. Bahwa terdakwa MUHAMMAD AUFAR menulis kalimat tersebut diatas karena mengomentari pemberitaan pada akun kumparan.com yang berjudul“Bawaslu Tunda Sidang Situng karena KPU Belum Siap kan Jawaban”. Bahwa terdakwa menjelaskan jika terdakwa tidak mempunyai kelompok atau tidak dari Partai Politik manapun terdakwa menyeruakan hal tersebut atas nama pribadi yang tidak menerima hasil pengumuman dari KPU. Bahwa terdakwa MUHAMMAD AUFAR menulis kalimat tersebut diatas dengan maksud supaya orang yang membaca postingan terdakwa tersebut dapat ikut melakukan people power pada tanggal 20-22 Mei 2019.",pasal 28 ayat 2
"Bahwa Terdakwa FAIZAL LOMBA alias FAIZAL KARAENG LOMBA pada hari Jum’at tanggal 24 Mei 2019 sekitar pukul 18.13 wita atau setidak-tidaknya pada waktu tertentu dalam bulan Mei 2019 atau setidak-tidaknya pada suatu waktu tertentu dalam tahun 2019 bertempat di Jalan Gunung Bawakaraeng No. 5A Kec. Ujung Pandang Kota Makassar atau setidak-tidaknya di suatu tempat tertentu yang masih termasuk dalam daerah hukum Pengadilan Negeri Makassar, dengan sengaja dan tanpa hak menyebarkan informasi yang ditujukan untuk menimbulkan rasa kebencian atau permusuhan individu dan/atau kelompok masyarakat tertentu berdasarkan atas suku, agama, ras dan antar golongan (SARA), yang dilakukan oleh Terdakwa dengan cara sebagai berikut: Bahwa pada waktu dan tempat sebagaimana tersebut di atas, Terdakwa melihat status di Facebook yang mengatakan Polisi jauh lebih jihad dari pada pendemo aksi 22 Mei 2019, sehingga Terdakwa memposting balasan di akun Facebook Faizal Karaeng Lomba milik Terdakwa dengan cara menulis status di facebook disertai gambar yang Terdakwa copy dari facebook; Bahwa status Terdakwa di akun facebook Faizal Karaeng Lomba adalah “Ya Allah luka kecil didramatisir..katanya mereka jauh lebih jihad..Hello boskuu !!! bukan saya membenci aparat, cuman sedikit infoji..sudah kewajiban aparat Negara menjalankan tugas untuk mengamankan situasi, toh juga mereka digaji tidak kerja gratis..ketika meninggal juga dia ada tunjangan buat anak istrinya boskuuu !!!!! Apakah itu disebut lebih jihad ?? PASANG OTAKMU DI KEPALA BUKA DI ETALASE DISPLAY TOLOL !!!! lebih jihad mana dengan anak yang meninggal dibunuh demi mencari keadilan..??? innalillahi wainna ilaihi rajiun…Get well very soon baut aparat Negara, janganki lupa kasih BETADIN lukata pak bosss !!! #KeadilanDiAtasSegalanya#KebenaranDiAtasSegalanya# TNIKEREN##BravoTentaraNasionalIndonesia#TNIDariRakyatUntukRakyat” yang disertai dengan gambar pada postingan tersebut. Bahwa maksud Terdakwa untuk memposting status di facebook adalah untuk menjelaskan Polisi tidak lebih berjihad daripada aksi 22 Mei 2019; Bahwa Terdakwa menjelaskan makna status Terdakwa di akun facebook miliknya adalah sebagai berikut: Ya Allah luka kecil didramatisir, maksudnya adalah ditujukan kepada pendukung 01 yang berpikir bahwa Polisi lebih jihad daripada pendemo pada aksi 22 Mei 2019, maknanya agar tidak ada yang mendramatisir luka polisi seolah besar, padahal polisi tidak perlu didramatisir; Katanya mereka jauh lebih jihad, ditujukan kepada pendukung 01 yang berpikir bahwa polisi lebih jihad daripada pendemo pada aksi 22 Mei 2019 maknanya bahwa menurut Terdakwa polisi itu jihad tapi lebih jihad dari peserta aksi; Hello boskuu !!! bukan saya membenci aparat, Cuma sedikit infoji… sudah kewajiban aparat Negara menjalankan tugas untuk mengamankan situasi, toh juga mereka digaji tidak kerja gratis…ketika meninggal juga dia ada tunjangan buat anak istrinya boskuuu!!!! Apakah itu disebut lebih jihad ??, ditujukan kepada pendukung 01 yang berpikir bahwa saya tidak membenci aparat maknanya bahwa Terdakwa Cuma menginfokan sudah kewajiban aparat Negara untuk mengamankan situasi, dan mereka mendapat tunjangan. Terdakwa mempertanyakan apakah yang begitu dimaksud lebih jihad? PASANG OTAKMU DIKEPALA BUKA DI ETALASE DISPLAY TOLOL !!! ditujukan kepada pendukung 01 yang berpikiran polisi lebih jihad maknanya agar yang ditujukan berpikir dengan menggunakan akal sehat; Lebih jihad mana dengan anak yang meninggal dibunuh demi mencari keadilan ??? innalillahi wainna ilaihi rajiun, ditujukan kepada pendukung 01, maknanya bahwa Terdakwa mempertanyakan lebih jihad mana anak yang meninggal demi mencari keadilan disbanding aparat yang bertugas. Karena sebelumnya Terdakwa melihat di sosmed ada seorang anak yang meninggal pada aksi 22 Mei 2019; Get well very soon baut aparat Negara, janganki lupa kasi BETADIN luka ta pak boss !!!, ditujukan untuk aparat yang terluka maknanya Terdakwa mendoakan aparat agar lekas sembuh dan mengingatkan untuk menyembuhkan luka tersebut; #KeadilanDiAtasSegalanya#KebenaranDiAtasSegalanya#TNIKEREN## BravoTentaraNasionalIndonesia#TNIDariRakyatUntukRakyat maknanya hanya hastag biasa dan tidak berisi link. Bahwa berdasarkan keterangan Ahli Informasi dan Transaksi Elektronik Dr. Ronny, S.Kom, M.Kom, MH menjelaskan bahwa perbuatan Terdakwa yang memposting status di akun facebook Faizal Karaeng Lomba milik Terdakwa adalah dapat memprovokasi golongan masyarakat tertentu untuk membenci aparat serta dapat menimbulkan rasa kebencian terhadap apparat; Bahwa berdasarkan keterangan Ahli Bahasa Drs. David Gustaaf Manuputty, M.Hum menerangkan bahwa konten video yang dibuat oleh Terdakwa tersebut sudah termasuk ujaran kebencian dan permusuhan individu dan/atau kelompok masyarakat tertentu berdasarkan Suku, Agama, Ras, Antar Golongan (SARA) karena dapat membangkitkan hati orang yang membaca atau melihat postingan tersebut menjadi marah, menjadi membenci apparat;",pasal 28 ayat 2
"Bahwa terdakwa Hotdiana Gurning, S.Pd pada hari Sabtu tanggal 12 Oktober 2019 sekira pukul 08.22 Wib atau setidak-tidaknya pada waktu lain tahun 2019 bertempat di Dusun Sidodadi Desa Air Hitam Kecamatan Kualuh Leidong Kabupaten Labuhan Batu Utara, atau setidak-tidaknya pada suatu tempat dalam daerah hukum Pengadilan Negeri Rantau Prapat, “Dengan sengaja dan tanpa hak menyebarkan informasi yang ditujukan untuk menimbulkan rasa kebencian atau permusuhan individu dan atau kelempok masyarakat tertentu berdasarkan atas suku, agama, ras dan antar golongan (SARA)"";",pasal 28 ayat 2
"Bahwa terdakwa SAMIUN ACHMAD,SE bin ACHMAD pada hari Kamis tanggal 25 April 2019 sekitar pukul 13.00 wita atau setidak – tidaknya pada waktu tertentu dalam bulan April 2019 atau setidak-tidaknya pada suatu waktu tertentu dalam tahun 2019 bertempat di Jalan Metro Tanjung Bunga antara Trans Studio dan Celebes Convention Center Kota Makassar atau setidak-tidaknya di suatu tempat tertentu yang masih termasuk dalam daerah hukum Pengadilan Negeri Makassar, dengan sengaja dan tanpa hak menyebarkan informasi yang ditujukan untuk menimbulkan rasa kebencian atau permusuhan individu dan/atau kelompok masyarakat tertentu berdasarkan atas suku, agama, ras dan antar golongan (SARA)",pasal 28 ayat 2
"Bahwa ia terdakwa H. MUH. SABIR Bin H. BASRI pada hari Sabtu tanggal 25 Mei 2019 sekitar pukul 20.00 wita, atau setidak-tidaknya pada waktu-waktu lain dalam tahun 2019, bertempat di rumah terdakwa di Jalan Goa Ria Kalantubung RT/RW : 001/007 Kel. Sudiang Kec. Biringkanaya Makassar, atau setidak-tidaknya pada tempat-tempat lain dalam daerah hukum Pengadilan Negeri Makassar, dengan sengaja dan tanpa hak menyebarkan informasi yang ditujukan untuk menimbulkan rasa kebencian atau permusuhan individu dan / atau kelompok masyarakat tertentu berdasarkan atas suku, agama, ras, dan antargolongan (SARA) ",pasal 28 ayat 2
"Bahwa ia terdakwa HERLANGGA Als ANGGA Als KHALID Bin AMIR HUSIN ALEK pada hari sabtu tanggal 25 Mei 2019 sekira pukul 03.49 WIB atau setidak – tidaknya pada suatu waktu dalam bulan Mei tahun 2019 atau setidak – tidaknya masih ditahun 2019, di Perum Taman Carina Blok 32 No. 12 Rt.04 Rw.02 Kec. Batu Aji – Kota Batam atau setidak – tidaknya di tempat lain yang masih termasuk dalam daerah hukum Pengadilan Negeri Batam yang berwenang memeriksa dan mengadili, Dengan sengaja dan tanpa hak menyebarkan Informasi yang ditujukan untuk menimbulkan rasa kebencian, permusuhan individu dan atau kelompok Masyarakat tertentu berdasarkan suku, agama, ras, dan antar golongan (SARA) sebagaimana dimaksud dalam Pasal 28 ayat (2)",pasal 28 ayat 2
"Bahwa ia terdakwa TITI DESTIANI MENDROFA pgl TITI pada hari Senin tanggal 5 November 2018 sekira pukul 16.00 Wib atau setidak-tidaknya pada waktu lain dalam bulan November tahun 2018 bertempat disebuah rumah tempat terdakwa bekerja sebagai pembantu rumah tangga di daerah Parak Gadang Kecamatan Padang Timur Kota Padang atau setidak-tidaknya pada suatu tempat yang masih termasuk dalam daerah hukum Pengadilan Negeri Padang yang berwenang memeriksa dan mengadili perkara ini, dengan sengaja dan tanpa hak menyebarkan informasi yang ditujukan untuk menimbulkan rasa kebencian atau permusuhan individu dan atau kelompok masyarakat tertentu berdasarkan atas suku, agama dan antar golongan (SARA) sebagaimana diatur dalam Pasal 28 ayat (2)",pasal 28 ayat 2
"Bahwa pada waktu dan tempat sebagaimana tersebut diatas terdakwa merasa jengkel dan marah terhadap ditujukan kepada seorang tetangga terdakwa yaitu saksi WATY Als. IBU WATY Als. NEK WATI, yang mana pada saat itu terdakwa telah kehilangan 2 (dua) buah galon air minum isi ulang dari teras depan rumah terdakwa dan terdakwa menduga saksi WATY Als. IBU WATY Als. NEK WATI yang telah mengambilnya, kemudian terdakwa ribut/bertengkar dengan suami terdakwa perihal tersebut yang mengakibatkan terdakwa menjadi emosi dan marah, lalu terdakwa membuka akun Facebook milik terdakwa yaitu akun An. JOCELYN ISABELLA TOBING dengan email : 083190218901 dan password : 081212115309, kemudian membuat postingan di akun facebook milik terdakwa tersebut dengan menggunakan 1(satu) unit handphone merek Samsung warna hitam namun tidak ingat typenya, yang mana handphone tersebut adalah milik suami terdakwa yang bernama JABAT PAMRI NABABAN, lalu terdakwa membuat postingan dengan kata-kata sebagai berikut : “Anjing anjing sial x w pny tetangga islam di kampung multatuli sini masa kt modi tukang air isi ulang ktY 2 galon kami udah dianter pas mlm itu jg tp buktiY engga ada pst ada yg iri siring samaku pa kt ustand ma di alquran di agama islam di ajarkn mencuri barang org di dpn rmh org klo itu bnr di agama islam di ajarkn ky gt q sumpahin demi nm tuhanku yg ambl 2 galonku di dpn rmhku hdpY seumr hdp jd miskin ga bkl dpt rejeki seumr hdp klrgY bkl sengsara seumur hdp. Islam ky tai babi sm klian pantesan rata2 org islam di kampung multatuli ini kebanyakan tukang pencuri hdpY slalu miskin slalu brkekurangan mkY mencuri 2 galon pnyku di dpn rmhku klo mnx udah miskin hdpY y miskin j ga ush pk ngmbl barang org yg bkn milikY mnx org islam di sini tanganY tangan panjang pencuri barang org ga malu y jd org islam maling ngmbl barang org pa lg ngakuY org islam taat sholat mdgn j ga ush ngaku2 org islam sebut j islam ktp ko maling ngmbl 2 galon pnyku di dpn rmhku” (sebagaimana Screenshot atau foto akun dilampirkan didalam berkas perkara). Bahwa akibat dari postingan terdakwa tersebut yang menyebarkan informasi yang ditunjukkan untuk menimbulkan rasa kebencian dan permusuhan Individu atau Kelompok masyarakat tertentu berdasarkan atas suku, agama dan golongan (SARA) atau penistaan terhadap agama islam, maka FPI (Front Pembela Islam) selaku Umat Islam merasa keberatan atas perbuatan terdakwa dan melaporkan terdakwa ke Polrestabes Medan",pasal 28 ayat 2
"Bahwa terdakwa PERDIANSYAH als FERDIANSYAH als FERDI bin NAZUROH EFENDI pada hari Rabu tanggal 22 Mei 2019 atau setidaktidaknya dalam serangkaian waktu dalam rentang tahun 2019 bertempat di daerah Gambir, Jakarta Pusat atau setidak-tidaknya di wilayah hukum Pengadilan Negeri Jakarta Pusat telah dengan sengaja dan tanpa hak menyebarkan informasi yang ditujukan untuk menimbulkan rasa kebencian atau permusuhan individu dan/atau kelompok masyarakat tertentu berdasarkan atas suku, agama, ras, dan antargolongan (SARA)",pasal 28 ayat 2
"Bahwa Terdakwa M. ILHAM Bin SATRAWAN (Alm)pada jam yang tidak diingat lagi hari Rabu tanggal 04Juli 2018 atau atau setidak-tidaknya pada waktu lain dalam bulan Juli 2018 atau setidak-tidaknya pada tahun 2018, dengan menggunakan 1 (satu) unit handphone merk Xiomi warna hitam silver model Redmi Note 5 , nomor Imei 1 : 867708030909386 dan Imei 2 : 867708030909394 yang berisikan 1 (satu) buah sim card telkomsel dengan nomor kartu : 621007486253694302; 1 (satu) buah sim card telkomsel 4G dengan nomor kartu : 621002586236584201 dan 1 (satu) buah memory card, bertempat dirumah terdakwa Jalan Putri Candra Midi Gang Sentosa Nomor 12 Rt.003 Rw.006 Kelurahan Sungai Bangkong Kecamatan Pontianak Kota Kota Pontianakatau atau setidak-tidaknya pada suatu tempat yang masih termasuk dalam Daerah Hukum Pengadilan Negeri Pontianak, telah melakukan perbuatan dengan sengaja dan tanpa hak menyebarkan informasi yang ditujukan untuk menimbulkan rasa kebencian atau permusuhan individu dan/atau kelompok masyarakat tertentu berdasarkan atas suku, agama ras dan antargolongan (SARA)",pasal 28 ayat 2
"Bahwa ia terdakwa HARIS KUSDI BASTARI, S, Si, pada Bulan Mei 2019 atau setidak pada suatu waktu dalam tahun 2019 bertempat di Desa Kedonganan,Kecamatan Kuta Kabupaten Badung, atau setidak-tidaknya di suatu tempat yang masih termasuk dalam Daerah hukum Pengadilan Negeri Denpasar yang berwenang memeriksa dan mengadili perkara dimaksud, dengan sengaja dan tanpa hak menyebarkan informasi yang ditujukan untuk menimbulkan rasa kebencian atau permusuhan individu dan/atau kelompok masyarakat tertentu berdasarkan atas suku, agama, ras, dan antar golongan (SARA).",pasal 28 ayat 2
"Bahwa terdakwa MOH. ARIF MUSLIM alias RIF_OPPSITEpada tanggal 3 Desember 2018 sampai dengan tanggal 23 Juni 2019 atau pada bulan Desember 2018sampai dengan bulan Juni 2019 atau setidak-tidaknya pada waktu-waktu tertentu di tahun 2018 sampai dengan tahun 2019 bertempat di rumah terdakwa di Jl. Tabrani Ahmad Komp. Borobudur A 10 Rt 002/027, Kelurahan Sungai Jawi Dalam Kecamatan Pontianak Barat, Kota Pontianak Kalimantan Baratatau setidak-tidaknya pada tempat-tempat lain yang masih termasuk dalam daerah hukum Pengadilan Negeri Pontianak berwenang untuk memeriksa dan mengadili perkaranya, beberapa perbuatan, meskipun masing-masing merupakan kejahatan atau pelanggaran, ada hubungannya sedemikian rupa sehingga harus dipandang sebagai satu perbuatan berlanjut, yaitudengan menyiarkan berita atau pemberitahuan bohong, dengan sengaja menerbitkan keonaran dikalangan rakyat",pasal 28 ayat 2
"Bahwa ia terdakwa SUPRAYITNO Bin HARJONO (Alm) sejak tanggal 12 Maret 2017 sampai dengan tanggal 14 Mei 2018 atau setidak-tidaknya antara bulan Maret 2017 sampai dengan bulan Mei 2018, bertempat di Jalan Tlogo Mukti Timur I / 878 RT.003 RW.026 Kelurahan Tlogosari Kulon, Kecamatan Pedurungan, Kota Semarang dan di Salon Rias milik istri terdakwa dengan alamat di Jalan Peterongan Timur No.324 B Kota Semarang atau setidak-tidaknya pada suatu tempat yang masih termasuk dalam daerah hukum Pengadilan Negeri semarang, telah dengan sengaja dan tanpa hak menyebarkan informasi yang ditujukan untuk menimbulkan rasa kebencian atau permusuhan individu dan/atau kelompok masyarakat tertentu berdasarkan atas suku, agama, ras dan antar golongan (SARA), sebagaimana dimaksud dalam Pasal 28 ayat (2) Undang-Undang RI Nomor 19 Tahun 2016",pasal 28 ayat 2
"Bahwa pada waktu dan tempat sebagaimana tersebut diatas, Terdakwa memposting / menyebarkan foto tersebut melalui media sosial melalui Facebook milik Terdakwa sendiri (a.n. akun : samuel kamke / Hp. 085822584065 / password kencet) dengan menggunakan handphone Xiaomi warna silver hitam milik Terdakwa. Kemudian Terdakwa memposting / menyebarkan foto tersebut ke group yang bernama Status Lucu Anak Remaja. Terdakwa mendapatkan foto tersebut setelah terdakwa mendownload dari postingan orang di fecebook di facebook yang Terdakwa lupa punya siapa, karena Terdakwa tidak berteman. Kemudian foto itu Terdakwa download di handphone Terdakwa sudah lama Namun Terdakwa sendiri yang telah membuat / menambahkan tulisan di foto tersebut menggunakan aplikasi dalam handpone Xiaomi milik Terdakwa. Namun “allah” yang Terdakwa maksud dalam tulisan yang Terdakwa buat dalam tulisan tersebut adalah tuhannya orang islam. Maksud dan tujuan Terdakwa adalah untuk mengolok-olok orang islam, karena Terdakwa tidak terima dengan ada orang islam yang menghina orang Kristen di group tersebut, Terdakwa dalam keadaaan sadar ketika membuat, memposting / menyebarkan foto dan tulisan tentang “ allah ” dalam media sosial group facebook Group Status Lucu Anak Remaja. Namun Terdakwa tidak ada merasa disuruh / dipaksa oleh orang lain untuk memposting / menyebarkan foto dan tulisan tentang ‘’ allah “ dalam media sosial facebook Group Status Lucu Anak Remaja tersebut",pasal 28 ayat 2
"Bahwa ia terdakwa ARIF KURNIAWAN RADJASA pada hari Sabtu tanggal 6 April 2019 sekitar pukul 19.00 Wib atau setidak tidaknya pada waktu lain dalam bulan April 2019 bertempat di dalam rumah di Jl. Raya Buncitan Nomor 149 Desa Buncitan Kecamatan Sedati Kabupaten Sidoarjo atau setidak tidaknya disuatu tempat yang masih termasuk dalam daerah hukum Pengadilan Negeri Sidoarjo, dengan sengaja menyiarkan berita atau pemberitahuan bohong, dengan sengaja menerbitkan keonaran di kalangan rakyat",pasal 28 ayat 2
"Berawal pada hari Minggu tanggal 21 April 2019, sekira pukul 04.21 WIB, Saksi Ilham Abduh yang merupakan anggota Kepolisian pada Polresta Barelang yang memiliki Media Sosial Whatsapp yang bernama “Ilham Pagau” dengan nomor 081270498777 melihat isi Whatsaap Handphonenya dimana salah satu anggota Whatsaap grup tersebut didalamnya juga ada Terdakwa A. Nurlina B als Andi dengan nomor handphone 085264231092 ada mengirimkan Video berita tentang “FULL WARGA SAMPANG MADURA KEPUNG BAWASLU DAN KPU SAMPANG”, yang mana selanjutnya pembicaraan di Media Sosial WhatsApp grup Warga KKSS BATAM-KEPRI tentang permasalahan pemelihat Presiden dan Wakil Presiden lalu sekira pukul 08.10 WIB Terdakwa Andi dengan nomor handphone 085264231092 meneruskan (Forwarded) Rekaman Suara (Voice Note), yang mana didalam Rekaman Suara tersebut ada seorang perempuan yang merekam suaranya dimana Voice Note tersebut berisi kata-kata yaitu “barusan ada suara tembakan jadi saya mohon kawan-kawan relawan segera merapat ke Gor Odessa Botania, juga kawan… bapak-bapak dari LPI dan FPI mohon segera ke Gor Odessa Botania ada satu kali tembakan dari Kepolisian, dua kali tembakan dari Kepolisian, saya fikir ini memang strategi dari mereka untuk buat kerusuhan supaya kami-kami yang di sini bubar, mohon..mohon… kawan-kawan relawan kemari”. Setelah Saksi Ilham mendengar kiriman Rekaman Suara yang diteruskan oleh Terdakwa tersebut ke Media Sosial Whatsapp Grup KKSS BATAM-KEPRI tersebut, Saksi Ilham merasa hal tersebut tidaklah benar dan tidak mungkin pihak Kepolisian dalam hal ini melakukan penembakan jika tidak ada hal-hal yang bersifat genting ; Bahwa selanjutnya sekira pukul 18.30 WIB, Saksi ALAMSAH Als YOGA dihubungi oleh Suami Terdakwa via handphone agar memberikan nomor handphone ketua KKSS Batam – Kepri karena Terdakwa memberikan berita bohong yang dapat membuat keonaran di kalangan masyarakat ; Bahwa Rekaman Suara tersebut dibuat/direkam oleh Sdri. KHALIJAH Als EZA pada hari Minggu tanggal 21 April 2019 sekira pukul 02.00 WIB Gor Odessa Botania Kecamatan Batam Kota – Kota Batam. Dan faktanya saat itu tidak terjadi keonaran dan situasi dalam keadaan aman dan terhadap Rekaman Suara yang dikirim oleh Terdakwa tidak benar-benar terjadi sesuai fakta di lapangan (hoax) ; Bahwa Terdakwa meneruskan (Forwarded) Rekaman Suara tersebut ke Group Warga Kerukunan Keluarga Sulawesi Selatan (KKSS) BATAMKEPRI, Grup MAEMUNAH FOR DPR RI, Grup KARTINI GERINDA NEW dan Grup BATAM GEEMA PRABOWOSANDI dengan tujuan agar teman dan keluarga Terdakwa mengetahui dan waspada bahwa ada tembakan yang dilakukan oleh Kepolisian di Gor Odessa Botani Batam. Sedangkan Terdakwa tidak mengetahui apakah Rekaman Suara yang dikirimnya merupakan kejadian yang benar-benar terjadi, dan Terdakwa sedang berada didalam rumah ketika mengirim Rekaman Suara tersebut ; Akibat perbuatan Terdakwa dalam meneruskan atau mengirim Rekaman Suara dan beberapa Video yang belum Terdakwa periksa kebenarannya, dapat menimbulkan keonaran atau keributan di Kalangan Masyarakat dan jika pemberitaan tersebut tidak benar maka Terdakwa telah memberikan pemberitaan yang tidak benar (hoax) ;",pasal 28 ayat 2
